,state,county,city,date,description,adl_id,fips_county,CountyState
327,FL,Miami-Dade,miami beach,2018-09-01,a swastika was spray-painted on the sidewalk that is across the street from a jewish day school.,6461,12086,Miami-Dade County FL
328,FL,Orange,maitland,2016-01-01,jewish school received a bomb threat.,1446,12095,Orange County FL
329,FL,Orange,orlando,2016-01-01,non-jewish elementary school student told jewish peer she did not like her because she was jewish.,1855,12095,Orange County FL
330,FL,Orange,orlando,2017-03-01,anti-semitic anti-semitic incident: harassment of jewish students in high school.,3216,12095,Orange County FL
331,FL,Orange,orlando,2017-10-01,jewish teacher victim of ongoing anti-semitic anti-semitic incident: harassment by students.,3243,12095,Orange County FL
332,FL,Orange,orlando,2017-10-01,jewish elementary school student victim of anti-semitic anti-semitic incident: harassment and threat by classmate.,3246,12095,Orange County FL
333,FL,Orange,winter park,2019-04-01,middle school student was the target of anti-semitic slurs and songs.,9698,12095,Orange County FL
334,FL,Orange,winter park,2019-10-01,a student attended school dressed as hitler for halloween and gave the nazi salute to other students.,12041,12095,Orange County FL
335,FL,Osceola,kissimmee,2016-03-01,class course website about insects displayed anti-semitic cartoons comparing jews to cockroaches.,1202,12097,Osceola County FL
336,FL,Palm Beach,boca raton,2016-02-01,"jewish students faced ongoing taunting and anti-semitic ""jokes"" from peers.",1944,12099,Palm Beach County FL
337,FL,Palm Beach,boca raton,2016-04-01,"middle school student heard multiple anti-semitic ""jokes"" during lunch.",266,12099,Palm Beach County FL
338,FL,Palm Beach,boca raton,2016-09-01,student found book covered with anti-semitic symbolism in history class.,268,12099,Palm Beach County FL
339,FL,Palm Beach,boca raton,2016-10-01,student harassed other students and drew swastikas on notebooks.,269,12099,Palm Beach County FL
340,FL,Palm Beach,boca raton,2017-02-01,"jewish student harassed with anti-semitic messages, including references to jews being cheap, swastikas, and message that the student's grandparents should have been ""roasted.""",3190,12099,Palm Beach County FL
341,FL,Palm Beach,boca raton,2018-12-01,a swastika was etched into a bathroom stall at a high school.,7124,12099,Palm Beach County FL
342,FL,Palm Beach,boca raton,2018-12-01,"""hail hitler"" and an image of a swastika were written in a bathroom stall at a high school.",7066,12099,Palm Beach County FL
343,FL,Palm Beach,boca raton,2019-07-01,jewish girl at a middle school received an anti-semitic text message from a classmate.,9877,12099,Palm Beach County FL
344,FL,Palm Beach,boca raton,2019-12-01,jewish high school student victim of ongoing anti-semitic harassment and bullying by classmate.,12131,12099,Palm Beach County FL
345,FL,Palm Beach,boynton beach,2017-02-01,anti-semitic note passed to jewish student.,3193,12099,Palm Beach County FL
346,FL,Palm Beach,jupiter,2016-03-01,"middle school students told another student, ""all jews should have died"" and ""hitler was right.""",1178,12099,Palm Beach County FL
347,FL,Palm Beach,jupiter,2017-12-01,two jewish students victims of ongoing anti-semitic anti-semitic incident: harassment at by school peers.,3262,12099,Palm Beach County FL
348,FL,Palm Beach,lantana,2017-05-01,swastikas and racial slurs found on walls at a high school.,3225,12099,Palm Beach County FL
349,FL,Palm Beach,loxahatchee,2016-03-01,students made offensive holocaust jokes and promoted anti-semitic conspiracy theories.,1423,12099,Palm Beach County FL
350,FL,Palm Beach,palm beach,2016-12-01,swastika drawn in pencil found inside school bathroom.,1876,12099,Palm Beach County FL
351,FL,Palm Beach,palm beach gardens,2016-01-01,jewish school received a bomb threat.,1878,12099,Palm Beach County FL
352,FL,Palm Beach,palm beach gardens,2016-04-01,"public school student called a ""jew"" in a derogatory fashion.",1879,12099,Palm Beach County FL
353,FL,Palm Beach,palm beach gardens,2017-11-01,jewish student discovered note with anti-semitic content in their backpack.,3261,12099,Palm Beach County FL
354,FL,Palm Beach,palm beach gardens,2019-12-01,jewish student at a high school was victim of verbal anti-semitic harassment by a peer.,12171,12099,Palm Beach County FL
355,FL,Palm Beach,wellington,2017-10-01,jewish students victims of anti-semitic comments at high school.,3239,12099,Palm Beach County FL
356,FL,Palm Beach,west palm beach,2016-02-01,jewish student harassed on social media.,2625,12099,Palm Beach County FL
357,FL,Palm Beach,west palm beach,2016-10-01,middle school student was the victim of anti-semitic bullying at school and targeted on social media.,2630,12099,Palm Beach County FL
358,FL,Pasco,holiday,2019-05-01,a student at paul r. smith middle school was arrested after he wrote a bomb threat on a bathroom wall that included images of swastikas.,11783,12101,Pasco County FL
359,FL,Pasco,spring hill,2017-05-01,a middle school student faced continued anti-semitic anti-semitic incident: harassment from fellow students.,3222,12101,Pasco County FL
360,FL,Polk,kissimmee,2016-03-01,class course website about insects displayed anti-semitic cartoons comparing jews to cockroaches.,1202,12105,Polk County FL
361,FL,St. Johns,ponte vedra beach,2016-01-01,jewish student witnessed peer receive a text filled with anti-semitic content directed at her.,1966,12109,St. Johns County FL
362,FL,Seminole,altamonte springs,2016-12-01,school vandalized with swastika.,48,12117,Seminole County FL
363,FL,Volusia,daytona beach,2016-01-01,middle school student made anti-semitic comments during a class discussion of the holocaust.,1066,12127,Volusia County FL
364,GA,Cherokee,canton,2016-10-01,"high school student experienced ongoing harassment by student who called him ""jew boy"" and ""jack the jew.""",456,13057,Cherokee County GA
365,GA,Cobb,marietta,2016-11-01,middle school student made anti-semitic remarks and gave a jewish student a piece of paper with a swastika drawing on it.,1502,13067,Cobb County GA
366,GA,Cobb,marietta,2017-04-01,a student threw money at another student and made anti-semitic comments towards her.,3297,13067,Cobb County GA
367,GA,Cobb,marietta,2018-04-01,jewish middle school student victim of anti-semitic bullying by peer.,5813,13067,Cobb County GA
368,GA,Cobb,marietta,2019-04-01,"a jewish student at a middle school found a note in their locker that read, ""kill yourself, you kike.""",9700,13067,Cobb County GA
369,GA,Columbia,augusta,2017-03-01,"middle school and high school students subjected to anti-semitic and holocaust-related ""jokes.""",3290,13073,Columbia County GA
370,GA,Forsyth,cumming,2017-03-01,"jewish middle school students harassed with holocaust-related ""jokes.""",3288,13117,Forsyth County GA
371,GA,Fulton,alpharetta,2016-02-01,"six middle school students performed ""heil hitler"" salute and called a boy ""hitler,"" in addition to swastikas found etched in school bathroom.",44,13121,Fulton County GA
372,GA,Fulton,alpharetta,2016-10-01,middle school students harassed other students with anti-semitic jokes.,46,13121,Fulton County GA
373,GA,Fulton,alpharetta,2019-02-01,student directed holocaust jokes at jewish students in class.,9555,13121,Fulton County GA
374,GA,Fulton,atlanta,2016-10-01,elementary school student victim of anti-semitic bullying by peer.,111,13121,Fulton County GA
375,GA,Fulton,atlanta,2016-11-01,swastika drawn in school bathroom.,118,13121,Fulton County GA
376,GA,Fulton,atlanta,2017-08-01,"a social media image of a group of high school students played a variation of beer pong, which they called ""nazis vs. jews"" went around the internet and community.",3305,13121,Fulton County GA
377,GA,Fulton,atlanta,2017-08-01,"elementary school teacher, who is jewish, discovered a swastika drawn on one of her planters.",3308,13121,Fulton County GA
378,GA,Fulton,atlanta,2018-02-01,"jewish students experiencing ongoing anti-semitic harassment by peers in their high school including being called ""kike.""",5619,13121,Fulton County GA
379,GA,Fulton,johns creek,2016-03-01,middle school student victim of ongoing anti-semitic harassment.,1162,13121,Fulton County GA
380,GA,Fulton,johns creek,2016-05-01,"multiple incidents of anti-semitic behavior reported at middle school, including students chanting ""heil hitler"" on school bus.",1163,13121,Fulton County GA
381,GA,Fulton,johns creek,2016-12-01,"jewish middle school student experienced ongoing bullying in the form of anti-semitic ""jokes"" and insults.""",1168,13121,Fulton County GA
382,GA,Fulton,johns creek,2016-12-01,"middle school student called a ""filthy jew"" after picking up a coin from the gym floor.",1166,13121,Fulton County GA
383,GA,Fulton,johns creek,2017-02-01,jewish students harassed with anti-semitic jokes.,3280,13121,Fulton County GA
384,GA,Fulton,johns creek,2017-03-01,"swastikas, a drawing of a gun, and the words ""you the jews"" found in restroom at middle school.",3289,13121,Fulton County GA
385,GA,Fulton,johns creek,2017-04-01,swastika found by a jewish student in the boy's bathroom of a middle school.,3295,13121,Fulton County GA
386,GA,Fulton,johns creek,2017-04-01,students directed the heil hitler salute to a jewish student during class.,3294,13121,Fulton County GA
387,GA,Fulton,johns creek,2017-05-01,"swastika with the letters spelling out ""nazi,"" discovered by an eighth-grade jewish boy in a school bathroom.",3299,13121,Fulton County GA
388,GA,Fulton,milton,2019-02-01,a swastika was drawn on a desk in a jewish teacher's classroom.,10080,13121,Fulton County GA
389,GA,Fulton,roswell,2019-02-01,a swastika was spray-painted on a pillar in front of centennial high school.,10078,13121,Fulton County GA
390,GA,Fulton,sandy springs,2017-02-01,several students distributed valentine's day notes with anti-semitic content.,3281,13121,Fulton County GA
391,GA,Grady,cairo,2016-01-01,middle school student the victim of ongoing anti-semitic jokes and taunts.,438,13131,Grady County GA
392,GA,Grady,cairo,2016-04-01,high school students posted anti-semitic content.,439,13131,Grady County GA
393,GA,Gwinnett,gwinnett county,2019-04-01,"a jewish student at a middle was harassed by another student who said ""death to all the jews"" and mocked the jewish student.",9699,13135,Gwinnett County GA
394,GA,Gwinnett,norcross,2017-03-01,anti-semitic anti-semitic incident: harassment of jewish high school student.,3286,13135,Gwinnett County GA
395,GA,Richmond,augusta,2017-03-01,"middle school and high school students subjected to anti-semitic and holocaust-related ""jokes.""",3290,13245,Richmond County GA
396,GA,Terrell,cairo,2016-01-01,middle school student the victim of ongoing anti-semitic jokes and taunts.,438,13273,Terrell County GA
397,GA,Terrell,cairo,2016-04-01,high school students posted anti-semitic content.,439,13273,Terrell County GA
398,IA,Polk,des moines,2017-11-01,two students victims of anti-semitic anti-semitic incident: harassment and threats.,3327,19153,Polk County IA
399,IA,Scott,bettendorf,2019-01-01,"jewish high school student was told to ""go back into the oven"" by a peer.",9511,19163,Scott County IA
400,IA,Scott,bettendorf,2019-02-01,"a jewish high school student was harassed and baited by another student who said that ""jews killed jesus.""",9561,19163,Scott County IA
401,ID,Kootenai,coeur d'alene,2018-06-01,"a swastika, and other offensive imagery, was burned into a high school's football field.",6183,16055,Kootenai County ID
402,ID,Teton,driggs,2019-10-01,students at teton high school dressed as hitler and a jewish person for halloween. the student dressed as hitler was pulling the student dressed as a jewish person around the school with a leash.,12039,16081,Teton County ID
403,ID,Teton,driggs,2019-10-01,students at teton high school dressed as hitler and a jewish person for halloween. the student dressed as hitler was pulling the student dressed as a jewish person around the school with a leash.,9995,16081,Teton County ID
404,IL,Cook,chicago,2016-05-01,anti-semitic remarks made during a student government hearing.,522,17031,Cook County IL
405,IL,Cook,chicago,2017-03-01,swastikas trampled into snow at elementary school.,3351,17031,Cook County IL
406,IL,Cook,chicago,2017-03-01,two jewish elementary school students were bullied with anti-semitic taunts by classmates.,3348,17031,Cook County IL
407,IL,Cook,chicago,2017-03-01,bomb threat - chicago jewish day school,3346,17031,Cook County IL
408,IL,Cook,chicago,2018-11-01,jewish boy at a middle school discovered a swastika had been drawn on his school locker.,6823,17031,Cook County IL
409,IL,Cook,chicago,2018-12-01,"orthodox jewish teacher was told by one of her students, ""i hate jews. i'm in the nation of islam and i don't like jews,"" and was repeatedly harassed with anti-semitic comments by other students.",7019,17031,Cook County IL
410,IL,Cook,chicago,2019-02-01,"a student made anti-semitic comments to a jewish student that included ""nail the jew to the wall"" and ""burn the jew.""",9557,17031,Cook County IL
411,IL,Cook,chicago,2019-03-01,"two hateful videos at whitney young high school were circulated to students, one of which showed student talking to another on facetime, as someone behind the girl holds a swastika.",9630,17031,Cook County IL
412,IL,Cook,chicago,2019-06-01,anti-semitic graffiti discovered at wilmette junior high school.,10334,17031,Cook County IL
413,IL,Cook,norridge,2018-07-01,"a swastika and ""nazi rules"" was painted onto a door at a school.",6277,17031,Cook County IL
414,IL,Cook,oak park,2018-11-01,an image of a swastika was sent to mostly jewish students via apple airdrop.,6755,17031,Cook County IL
415,IL,Cook,oak park,2018-11-01,"anti-semitic and racist graffiti written in a bathroom at a school that included a swastika and the message: ""gas the jews.""",6844,17031,Cook County IL
416,IL,Cook,orland park,2019-03-01,"ongoing anti-semitic harassment of a boy in a junior high school by his peers, that included anti-semitic messages sent via snapchat.",9631,17031,Cook County IL
417,IL,Cook,river forest,2018-11-01,swastika graffiti discovered in the bathroom at a high school.,6896,17031,Cook County IL
418,IL,Cook,wilmette,2019-07-01,"swastika and ""kill jews"" graffitied together with bomb threat at middle school.",10377,17031,Cook County IL
419,IL,Cook,wilmette,2019-10-01,students at wilmette junior high school reported that a swastika had been drawn in one of the school bathrooms.,10503,17031,Cook County IL
420,IL,Lake,antioch,2018-09-01,jewish boy received anti-semitic death threats from classmates in school via social media.,6404,17097,Lake County IL
421,IL,Lake,grayslake,2019-08-01,high school science teacher made insensitive comments about the holocaust in presence of jewish student.,9915,17097,Lake County IL
422,IL,Lake,hawthorn woods,2019-04-01,middle school student targeted a jewish classmate with anti-semitic jokes and rhetoric.,9702,17097,Lake County IL
423,IL,Lake,lake zurich,2019-12-01,a large swastika was spray-painted on the exterior wall at seth paine elementary school.,12301,17097,Lake County IL
424,IL,McLean,normal,2019-03-01,"a swastika and the message, ""i hate minorities"" was written on the walls and lockers at a high school.",10132,17113,McLean County IL
425,IL,Will,plainfield,2019-12-01,"after a jewish student brought a menorah to school for hanukkah, a classmate passed him a note with a swastika on it.",12135,17197,Will County IL
426,IN,Boone,zionsville,2019-01-01,students at zionsville community high school posted a photo of themselves on social media doing the nazi salute.,9509,18011,Boone County IN
427,IN,Floyd,floyds knobs,2018-08-01,swastika vandalism and homophobic slurs were graffitied onto a school bus parked at an elementary school.,6368,18043,Floyd County IN
428,IN,Marion,indianapolis,2018-09-01,swastika graffiti was discovered inside a bathroom at a high school.,6474,18097,Marion County IN
429,IN,Monroe,bloomington,2019-01-01,anti-semitic messages were written on a bathroom stall in a restroom at bloomington high school.,10027,18105,Monroe County IN
430,IN,Monroe,bloomington,2019-01-01,"anti-semitic vandalism that included swastikas and the message ""kill jews"" was written in a bathroom at a high school.",10028,18105,Monroe County IN
431,KY,Bullitt,mount washington,2019-05-01,"a jewish student was stabbed with a pencil three times and called an ""ugly jew"" and ""loser jew,"" the student was also told ""wish you were dead, jew"" by another student at school.",10563,21029,Bullitt County KY
432,KY,Bullitt,mount washington,2019-05-01,"a jewish student was stabbed with a pencil three times and called an ""ugly jew"" and ""loser jew,"" the student was also told ""wish you were dead, jew"" by another student at school.",11774,21029,Bullitt County KY
433,KY,Fayette,lexington,2017-01-01,swastika found in restroom at high school.,3405,21067,Fayette County KY
434,KY,Oldham,goshen,2017-08-01,swastika graffiti was discovered on a student's car at a high school.,3407,21185,Oldham County KY
435,LA,East Baton Rouge Parish,baton rouge,2018-05-01,"students at a high school made derogatory statements and gave ""heil hitler"" salutes to a jewish student and her friend.",6042,22033,East Baton Rouge Parish County LA
436,LA,Jefferson Parish,westwego,2018-12-01,jewish student victim of anti-semitic bullying.,6976,22051,Jefferson Parish County LA
437,LA,Lafayette Parish,lafayette,2019-03-01,"jewish student was bullied by peers at school who told him to ""go back to the concentration camps.",9633,22055,Lafayette Parish County LA
438,LA,Lafayette Parish,lafayette,2019-11-01,"jewish middle school student was told she should ""go back to the ovens"" when she said she was cold.",10859,22055,Lafayette Parish County LA
439,LA,Orleans Parish,new orleans,2018-11-01,school peer drew a swastika on a piece of paper in front of jewish classmate.,6788,22071,Orleans Parish County LA
440,LA,Orleans Parish,new orleans,2019-04-01,"a student at an elementary school repeatedly did the sieg heil and stated ""for the fuehrer.""",9707,22071,Orleans Parish County LA
441,MA,Barnstable,eastham,2019-08-01,anti-semitic bullying of high school student.,9917,25001,Barnstable County MA
442,MA,Berkshire,great barrington,2019-10-01,"a student at monument valley regional middle school made a ""hit list"" of jewish students and threatened to ""kill all the jews.""",10831,25003,Berkshire County MA
443,MA,Bristol,easton,2019-05-01,"a middle school student was given a note with swastika drawings by a student who also did the nazi salute and said ""heil hitler.""",9775,25005,Bristol County MA
444,MA,Bristol,easton,2019-05-01,swastika vandalism discovered in a bathroom at a high school.,10267,25005,Bristol County MA
445,MA,Essex,andover,2018-10-01,a swastika chalked on steps near a basketball court and playground at a school.,6633,25009,Essex County MA
446,MA,Essex,beverly,2019-01-01,a swastika was sketched into a desk at a high school.,10032,25009,Essex County MA
447,MA,Essex,boxford,2018-11-01,swastika vandalism discovered in a high school bathroom.,6898,25009,Essex County MA
448,MA,Essex,boxford,2018-11-01,swastika vandalism discovered in a high school bathroom.,6897,25009,Essex County MA
449,MA,Essex,boxford,2018-11-01,a number of swastikas were discovered in a high school over the course of two weeks.,6895,25009,Essex County MA
450,MA,Essex,boxford,2018-11-01,swastika vandalism discovered in a high school bathroom.,6894,25009,Essex County MA
451,MA,Essex,georgetown,2016-05-01,swastika drawn on football field at middle school.,968,25009,Essex County MA
452,MA,Essex,georgetown,2019-02-01,a custodian discovered swastika graffiti in a bathroom at georgetown middle high school.,10084,25009,Essex County MA
453,MA,Essex,marblehead,2016-01-01,photo of swastika made of pennies circulated on social media at a high school.,1498,25009,Essex County MA
454,MA,Essex,marblehead,2016-04-01,swastika carved into school bleachers.,1497,25009,Essex County MA
455,MA,Essex,marblehead,2016-06-01,"parent at high school softball game yelled ""beat those jews"" at player on opposing team.",1499,25009,Essex County MA
456,MA,Essex,marblehead,2017-08-01,swastika drawn in the dirt at marblehead high school's softball field.,3521,25009,Essex County MA
457,MA,Essex,newburyport,2018-10-01,"a student at a middle school proclaimed ""i am not going to sit there, that's the chair for jews!""",6568,25009,Essex County MA
458,MA,Essex,newburyport,2019-05-01,a student at newburyport high school made the nazi salute while standing near two jewish students. the same student also altered the school's song to praise hitler.,9779,25009,Essex County MA
459,MA,Essex,swampscott,2019-03-01,a student at a middle school made anti-semitic remarks to a jewish student about gas chambers.,9635,25009,Essex County MA
460,MA,Franklin,colrain,2016-11-01,jewish elementary school student told by another student that jewish people are an inferior species.,618,25011,Franklin County MA
461,MA,Franklin,deerfield,2018-02-01,drawing of a swastika discovered on a path on school grounds.,5674,25011,Franklin County MA
462,MA,Hampden,agawam,2018-12-01,jewish boy victim of anti-semitic harassment by other students at his gymnasium.,7027,25013,Hampden County MA
463,MA,Hampden,east longmeadow,2018-12-01,jewish students were verbally harassed and called anti-semitic names on the school bus.,7014,25013,Hampden County MA
464,MA,Hampden,longmeadow,2016-06-01,photo in middle school yearbook showed student performing the nazi salute.,1346,25013,Hampden County MA
465,MA,Hampden,springfield,2018-06-01,"a teacher was harassed by a student who repeatedly called her ""jew"" in a derogatory way.",6111,25013,Hampden County MA
466,MA,Hampden,wilbraham,2019-12-01,a jewish high school student was added to a snapchat group with a swastika as the group name. members of this snapchat group subsequently sent anti-semitic images and messages to the jewish student.,12200,25013,Hampden County MA
467,MA,Hampshire,amherst,2016-12-01,anti-semitic jokes and incidents at middle school.,53,25015,Hampshire County MA
468,MA,Hampshire,amherst,2018-12-01,a swastika was taped to the back of a student at a high school.,7029,25015,Hampshire County MA
469,MA,Middlesex,acton,2018-06-01,"anti-semitic graffiti that included a jewish star, ""jude,"" and two x's was found on an athletic storage trailer at a high school.",6152,25017,Middlesex County MA
470,MA,Middlesex,arlington,2016-03-01,swastika and racist graffiti found at middle school.,79,25017,Middlesex County MA
471,MA,Middlesex,arlington,2018-02-01,"anti-semitic graffiti including swastikas, discovered in a boys bathroom at ottoson middle school.",5652,25017,Middlesex County MA
472,MA,Middlesex,arlington,2018-05-01,homophobic and anti-semitic graffiti was found in the faculty parking lot of a high school.,6048,25017,Middlesex County MA
473,MA,Middlesex,arlington,2018-12-01,jewish student received an anti-semitic message on snapchat in response to a snapchat message of a menorah.,7013,25017,Middlesex County MA
474,MA,Middlesex,arlington,2019-10-01,anti-semitic graffiti and messages found in a bathroom at ottoson middle school.,10507,25017,Middlesex County MA
475,MA,Middlesex,ashland,2018-01-01,"jewish student victim of anti-semitic harassment and bullying, told by another student that jews are cheap and control the banks.",5515,25017,Middlesex County MA
476,MA,Middlesex,billerica,2016-11-01,swastika graffitied on school building.,809,25017,Middlesex County MA
477,MA,Middlesex,cambridge,2016-12-01,anti-semitic graffiti including swastikas drawings and hateful language discovered in high school bathroom.,448,25017,Middlesex County MA
478,MA,Middlesex,cambridge,2019-10-01,swastika vandalism discovered at cambridge rindge and latin school.,10505,25017,Middlesex County MA
479,MA,Middlesex,dracut,2018-02-01,three swastika drawings discovered in bathrooms at a middle school.,5649,25017,Middlesex County MA
480,MA,Middlesex,framingham,2016-03-01,"middle school students made anti-semitic remarks, blamed jews and israel for 9/11 terrorist attacks.",924,25017,Middlesex County MA
481,MA,Middlesex,framingham,2016-12-01,"high school hockey player victim of anti-semitic ""jokes"" while being hazed.",925,25017,Middlesex County MA
482,MA,Middlesex,framingham,2017-03-01,bomb threat - metrowest jewish day school,3456,25017,Middlesex County MA
483,MA,Middlesex,framingham,2019-05-01,"a swastika and a ""vague, threatening message"" was discovered inside a bathroom at keefe technical high school.",10268,25017,Middlesex County MA
484,MA,Middlesex,framingham,2019-10-01,"students at christa mcauliffe charter school created an anti-semitic snapchat group called ""kill the jews,"" which they then sent to jewish and non-jewish students. they also posted anti-semitic messages using words like ""kike.""",9999,25017,Middlesex County MA
485,MA,Middlesex,lexington,2018-05-01,swastika vandalism at elementary school.,6086,25017,Middlesex County MA
486,MA,Middlesex,lexington,2018-05-01,a swastika was drawn on a toilet paper dispenser in a bathroom at a high school.,6069,25017,Middlesex County MA
487,MA,Middlesex,malden,2018-11-01,swastika vandalism discovered in an elevator at a high school.,6827,25017,Middlesex County MA
488,MA,Middlesex,marlborough,2016-03-01,boy was victim of anti-semitic bullying in school.,1507,25017,Middlesex County MA
489,MA,Middlesex,melrose,2018-11-01,swastika vandalism discovered in a bathroom at a middle school.,6828,25017,Middlesex County MA
490,MA,Middlesex,melrose,2019-05-01,a bathroom at a middle school was vandalized with graffiti that included two swastika drawings.,10276,25017,Middlesex County MA
491,MA,Middlesex,natick,2016-01-01,high school student victim of anti-semitic verbal harassment.,1690,25017,Middlesex County MA
