,state,county,city,date,description,adl_id,fips_county,CountyState
0,AL,Colbert,tuscumbia,2018-12-04,"an unknown person or group distributed a flier at deshler high school which used an anti-semitic image to define the word ""avarice.""",5336,1033,Colbert County AL
1,AL,Jefferson,birmingham,2017-02-01,bomb threat - n.e. miles jewish day school,2717,1073,Jefferson County AL
2,AL,Jefferson,mountain brook,2018-10-01,"anti-semitic, anti-minority, and racial graffiti was discovered inside a bathroom at a middle school.",6624,1073,Jefferson County AL
3,AL,Jefferson,mountain brook,2019-03-01,a non-jewish student made anti-semitic comments to a jewish student in school.,9597,1073,Jefferson County AL
4,AL,Mobile,grand bay,2018-01-01,"swastika drawing and ""hail hitler"" written in bathroom stall at a middle school.",5580,1097,Mobile County AL
5,AL,Mobile,mobile,2016-05-01,"""hitler did nothin' wrong"" painted outside classroom.",1625,1097,Mobile County AL
6,AL,Shelby,birmingham,2017-02-01,bomb threat - n.e. miles jewish day school,2717,1117,Shelby County AL
7,AR,Boone,little rock,2017-03-01,swastika anti-semitic incident: vandalism at school.,2720,5009,Boone County AR
8,AR,Pulaski,little rock,2017-03-01,swastika anti-semitic incident: vandalism at school.,2720,5119,Pulaski County AR
9,AR,Yell,danville,2018-02-01,swastika graffiti discovered at a high school.,5655,5149,Yell County AR
10,AZ,Maricopa,gilbert,2019-03-11,"folks front, a neo-nazi group, distributed anti-semitic fliers that featured a swastika at perry high school.",9598,4013,Maricopa County AZ
11,AZ,Maricopa,glendale,2018-10-01,"a middle school student was told by a peer: ""you're a jew. i'm going to burn you!""",6579,4013,Maricopa County AZ
12,AZ,Maricopa,glendale,2018-10-01,"a middle school-aged jewish boy was verbally assaulted by his teacher in front of his classmates, and told him he was not a jew.",6493,4013,Maricopa County AZ
13,AZ,Maricopa,goodyear,2016-08-01,student was target of anti-semitic bullying.,986,4013,Maricopa County AZ
14,AZ,Maricopa,mesa,2019-01-29,"folks front, a neo-nazi group, distributed anti-semitic fliers at skyline high school that featured a swastika in place of the letter ""o"" in the word ""love"" and the jewish star in place of the letter ""a"" in the word ""hate.""",9491,4013,Maricopa County AZ
15,AZ,Maricopa,paradise valley,2017-02-01,elementary school building defaced with swastikas.,2725,4013,Maricopa County AZ
16,AZ,Maricopa,paradise valley,2017-02-01,students made jokes about concentration camps and performed the nazi salute.,2729,4013,Maricopa County AZ
17,AZ,Maricopa,paradise valley,2018-02-01,students at a high school gathered to form a swastika with their bodies.,5609,4013,Maricopa County AZ
18,AZ,Maricopa,peoria,2018-01-01,jewish middle school student experiencing ongoing anti-semitic harassment in school by peers.,5521,4013,Maricopa County AZ
19,AZ,Maricopa,phoenix,2017-03-01,"racist, anti-semitic graffiti at high school.",2736,4013,Maricopa County AZ
20,AZ,Maricopa,phoenix,2017-03-01,jewish student being harassed for wearing star of david necklace.,2732,4013,Maricopa County AZ
21,AZ,Maricopa,phoenix,2018-12-01,swastika graffiti discovered in a stairwell at a high school.,7065,4013,Maricopa County AZ
22,AZ,Maricopa,scottsdale,2017-02-01,four incidents reported of children drawing swastikas at local school.,2728,4013,Maricopa County AZ
23,AZ,Maricopa,scottsdale,2018-12-01,jewish high school student victim of anti-semitic harassment and bullying in school by classmate.,7024,4013,Maricopa County AZ
24,AZ,Mohave,bullhead city,2018-09-01,elementary school student was a victim of anti-semitic bullying that included taunts and written harassment.,6390,4015,Mohave County AZ
25,AZ,Pima,tucson,2017-02-01,"jewish student harassed by peers with holocaust ""jokes.""",2726,4019,Pima County AZ
26,AZ,Pima,tucson,2017-10-01,jewish high school student victim of anti-semitic bullying at school.,2745,4019,Pima County AZ
27,AZ,Pima,tucson,2019-09-01,"drawings of swastikas, guns, and nooses were found on bathroom walls in a high school.",11958,4019,Pima County AZ
28,AZ,Pima,vail,2017-05-01,ongoing anti-semitic anti-semitic incident: harassment and bullying at a school.,2739,4019,Pima County AZ
29,AZ,Pinal,maricopa,2016-03-01,student was target of anti-semitic bullying,1501,4021,Pinal County AZ
30,CA,Alameda,alameda,2017-01-01,"jewish high school student harassed by classmates. she received text messages with pictures of nazis and the word ""kike,"" and verbal comments including anti-israel messages and that hitler should have ""finished the job.""",2757,6001,Alameda County CA
31,CA,Alameda,alameda,2017-05-01,"graffiti including two swastikas, the nazi flag, and image of a bag of money with a star of david next to it, and the words ""jews are evil"" were found etched into a desk at a high school.",2893,6001,Alameda County CA
32,CA,Alameda,alameda,2017-06-01,anti-semitic graffiti found at elementary school.,2914,6001,Alameda County CA
33,CA,Alameda,alameda,2018-06-01,swastika graffiti discovered at a high school.,6143,6001,Alameda County CA
34,CA,Alameda,albany,2017-03-01,nine high school students painted swastikas and harassed jewish teacher.,2840,6001,Alameda County CA
35,CA,Alameda,albany,2018-02-01,"for valentine's day, a middle school student inundated a school printer with hundreds of copies of a picture of hitler and a message saying.""",5614,6001,Alameda County CA
36,CA,Alameda,berkeley,2017-09-01,"anti-semitic and racist instagram account ""i hate jews"" created by berkeley high school students.",2962,6001,Alameda County CA
37,CA,Alameda,berkeley,2018-10-08,"a daily stormer book club, an alt right group, distributed flyers at maybeck high school. the flyers read: ""every time some anti-white, anti-america, anti-freedom event takes place, you look at it, and it's jews behind it.""",4823,6001,Alameda County CA
38,CA,Alameda,fremont,2016-12-01,yearbook quote referencing swastikas and nazi symbolism was submitted using the name of a jewish student.,940,6001,Alameda County CA
39,CA,Alameda,fremont,2017-06-01,students vandalized school with graffiti that included a swastika.,2904,6001,Alameda County CA
40,CA,Alameda,oakland,2016-12-01,high school teacher promoted holocaust denial and anti-semitic conspiracy theories.,1804,6001,Alameda County CA
41,CA,Alameda,piedmont,2018-05-01,anti-semitic language disseminated on high school listserv.,5912,6001,Alameda County CA
42,CA,Alameda,piedmont,2019-10-01,"high school students circulated anti-semitic memes. one meme said: ""what is the difference between a jew and a dollar?"" the second said ""i'd give a shit if i lost 6 million dollars.""",9976,6001,Alameda County CA
43,CA,Alameda,san lorenzo,2018-05-01,anti-semitic verbal harassment by teacher towards students.,5938,6001,Alameda County CA
44,CA,San Francisco,san francisco,2017-11-01,middle school student caught carving a swastika into a desk.,2997,6075,San Francisco County CA
45,CA,San Francisco,san francisco,2017-11-01,"student drew a swastika and wrote ""heil hitler"" with a sharpie on a desk in a jewish teacher's classroom.",2996,6075,San Francisco County CA
46,CA,San Francisco,san francisco,2017-11-01,opposing soccer team harassed jewish high school players with anti-semitic taunts.,2990,6075,San Francisco County CA
47,CA,San Francisco,san francisco,2019-12-01,"a jewish student was harassed by her peers who told her ?you?re just being greedy and wanting attention because you are a jew.""",12145,6075,San Francisco County CA
48,CA,Contra Costa,alamo,2017-11-01,"student continuously harassing other students saying he""will slaughter your jewish god"" and ""smack your jewish girlfriend's dick.""",2995,6013,Contra Costa County CA
49,CA,Contra Costa,danville,2016-03-01,jewish girl at middle school victim of anti-semitic bullying by peers.,696,6013,Contra Costa County CA
50,CA,Contra Costa,el cerrito,2018-11-01,"jewish boy verbally harassed by classmates who called him a ""penny-pincher jew,"" among other things.",6763,6013,Contra Costa County CA
51,CA,Contra Costa,lafayette,2016-04-01,"jewish high school student told by his peers ""you should have burned like all the rest of the jews.""",1223,6013,Contra Costa County CA
52,CA,Contra Costa,lafayette,2016-09-01,anti-semitic flyers referencing local high schools found on public transportation.,113,6013,Contra Costa County CA
53,CA,Contra Costa,moraga,2017-09-01,a middle school student drew a swastika on the pavement at school.,2958,6013,Contra Costa County CA
54,CA,Contra Costa,orinda,2016-09-01,"members of a high school cheerleading squad made references to burning jews and posted ""hail hitler"" on social media.",1854,6013,Contra Costa County CA
55,CA,Contra Costa,walnut creek,2016-12-01,high school student harassed jewish students.,2539,6013,Contra Costa County CA
56,CA,Contra Costa,walnut creek,2017-10-01,"jewish student called a a ""yiddish piece of shit"" by a classmate.",2974,6013,Contra Costa County CA
57,CA,Contra Costa,walnut creek,2018-07-01,high school student drew a swastika on his phone and showed it to his jewish classmate.,6222,6013,Contra Costa County CA
58,CA,Los Angeles,agoura hills,2019-08-01,an etching of a swastika was discovered on the stall of a bathroom at a public high school with a large jewish student population.,10402,6037,Los Angeles County CA
59,CA,Los Angeles,altadena,2016-12-01,"middle school student told by another student, ""go to the gas chamber, dirty jew.""",47,6037,Los Angeles County CA
60,CA,Los Angeles,azusa,2018-05-01,a group of students used anti-semitic slurs to target a student.,6035,6037,Los Angeles County CA
61,CA,Los Angeles,beverly hills,2018-05-01,"graffiti, that included a drawing of a swastika, was discovered on the exterior wall of a jewish day school.",6049,6037,Los Angeles County CA
62,CA,Los Angeles,burbank,2017-03-01,anti-semitic anti-semitic incident: harassment of middle school student by classmate.,2851,6037,Los Angeles County CA
63,CA,Los Angeles,calabasas,2017-05-01,swastika drawn in feces discover in a boy's bathroom at a high school.,2884,6037,Los Angeles County CA
64,CA,Los Angeles,calabasas,2018-05-01,a swastika was spray-painted on the bathroom wall at a high school.,6065,6037,Los Angeles County CA
65,CA,Los Angeles,calabasas,2018-06-03,"an unknown person or group posted white supremacist flyers at a public high school. the flyers read: ""khazar = jewish ghetto police.""",440,6037,Los Angeles County CA
66,CA,Los Angeles,calabasas,2018-10-01,"three swastikas were drawn on the campus of a public high school, which has a large jewish population.",6618,6037,Los Angeles County CA
67,CA,Los Angeles,calabasas,2019-03-01,"anti-semitic fliers were discovered at a high school that asked ""what is the difference between crackheads and jews?"" a swastika and the message ""the murder of innocent women and children by a rothschild led jewish zionist armed militia to forcibly confiscate the land of palestine now known as israel.""",9611,6037,Los Angeles County CA
68,CA,Los Angeles,long beach,2016-05-01,casual references to the holocaust and anti-semitic jokes made in a middle school classroom.,1332,6037,Los Angeles County CA
69,CA,Los Angeles,long beach,2016-08-01,elementary school teacher performed nazi salute to class during the united states pledge of allegiance.,1333,6037,Los Angeles County CA
70,CA,Los Angeles,long beach,2016-09-01,jewish middle school student harassed by classmate at school and via text and social media.,1334,6037,Los Angeles County CA
71,CA,Los Angeles,long beach,2016-11-01,"jewish student targeted with anti-semitic harassment after substitute teacher fails to stop students doing the ""heil hitler"" and chanting ""kill the jews.""",1335,6037,Los Angeles County CA
72,CA,Los Angeles,long beach,2017-09-01,jewish middle school student bullied with anti-semitic jokes and comments.,2964,6037,Los Angeles County CA
73,CA,Los Angeles,los angeles,2017-02-01,westboro baptist church hate group protested outside jewish high school.,2813,6037,Los Angeles County CA
74,CA,Los Angeles,los angeles,2017-10-01,"man drove by jewish high school yelling ""white power"" and made obscene gestures.",2979,6037,Los Angeles County CA
75,CA,Los Angeles,los angeles,2018-03-01,a piece of paper with negative comments about jewish people was found under a school administrator's door.,5750,6037,Los Angeles County CA
76,CA,Los Angeles,los angeles,2018-04-01,individual received anti-semitic emails to her work email. victim works for a school.,5855,6037,Los Angeles County CA
77,CA,Los Angeles,los angeles,2018-12-01,"anti-semitic note left at a school that included the words ""fake ass jew.""",7005,6037,Los Angeles County CA
78,CA,Los Angeles,los angeles,2019-03-01,swastika vandalism discovered in a school.,11680,6037,Los Angeles County CA
79,CA,Los Angeles,los angeles,2019-04-01,swastika etching discovered on a school window.,11748,6037,Los Angeles County CA
80,CA,Los Angeles,los angeles,2019-04-01,"anti-semitic graffiti that included the words ""das juden"" and a swastika were spray-painted on an exterior wall at an elementary school.",10190,6037,Los Angeles County CA
81,CA,Los Angeles,los angeles,2019-05-01,"a swastika and the message, ""kill the jews,"" was written on a school sign.",11797,6037,Los Angeles County CA
82,CA,Los Angeles,los angeles,2019-05-01,swastika etchings discovered on a school door.,11796,6037,Los Angeles County CA
83,CA,Los Angeles,los angeles,2019-06-01,individual verbally harassed a jewish family outside a jewish school and attacked the parent with a knife.,11835,6037,Los Angeles County CA
84,CA,Los Angeles,los angeles,2019-06-01,"individual yelled ""death to jews,"" at a parent picking up their child from a jewish day school.",11814,6037,Los Angeles County CA
85,CA,Los Angeles,los angeles,2019-10-01,an etching of a swastika was discovered on a classroom door at an elementary school.,10493,6037,Los Angeles County CA
86,CA,Los Angeles,los angeles,2019-10-01,"a teacher at a middle school was harassed with anti-semitic taunts, and later discovered that her classroom door was vandalized with a swastika and other inappropriate graffiti.",10494,6037,Los Angeles County CA
87,CA,Los Angeles,los angeles,2019-10-01,individual walked by a jewish school holding a hammer and yelled he was a nazi.,12006,6037,Los Angeles County CA
88,CA,Los Angeles,los angeles,2019-10-01,elementary school students harassing other students with the sieg heil/heil hitler salute.,9985,6037,Los Angeles County CA
89,CA,Los Angeles,los angeles,2019-11-01,"swastika graffiti and ""kill the jews"" was spray-painted in the vicinity of a synagogue and non-jewish school.",10836,6037,Los Angeles County CA
90,CA,Los Angeles,los angeles,2019-11-01,swastika etching discovered on a school door.,12088,6037,Los Angeles County CA
91,CA,Los Angeles,los angeles,2019-12-01,swastika graffiti discovered at an elementary school.,12222,6037,Los Angeles County CA
92,CA,Los Angeles,los angeles,2019-12-01,a student defaced school property with a swastika drawing.,12168,6037,Los Angeles County CA
93,CA,Los Angeles,marina del ray,2019-04-01,swastika vandalism discovered at a school.,11744,6037,Los Angeles County CA
94,CA,Los Angeles,north hollywood,2019-04-01,swastika vandalism discovered at a school.,11745,6037,Los Angeles County CA
95,CA,Los Angeles,north hollywood,2019-09-01,a swastika etching was discovered on a desk at a middle school.,10438,6037,Los Angeles County CA
96,CA,Los Angeles,northridge,2016-04-01,swastika and other graffiti found on school wall.,1795,6037,Los Angeles County CA
97,CA,Los Angeles,northridge,2019-11-01,"two swastikas and the message, ""we are ready to kill everyone"" was found on bathroom wall at a high school.",12076,6037,Los Angeles County CA
98,CA,Los Angeles,pacific palisades,2017-04-01,anti-semitic graffiti in school.,2868,6037,Los Angeles County CA
99,CA,Los Angeles,pasadena,2017-02-01,child drew swastika and showed it to a jewish classmate.,2816,6037,Los Angeles County CA
100,CA,Los Angeles,santa clarita,2019-10-01,high school bathroom vandalized with swastika etching.,10818,6037,Los Angeles County CA
101,CA,Los Angeles,santa clarita,2019-10-01,"swastikas, anti-semitic slurs, racial slurs, and other offensive graffiti were discovered at a high school.",10819,6037,Los Angeles County CA
102,CA,Los Angeles,sherman oaks,2019-03-01,swastika vandalism discovered at an elementary school.,10117,6037,Los Angeles County CA
103,CA,Los Angeles,south pasadena,2017-02-01,"jewish middle school student harassed by classmates with references to ""burning jews.""",2775,6037,Los Angeles County CA
104,CA,Los Angeles,south pasadena,2018-05-01,a high school student created an instagram account to post anti-semitic pictures and target a jewish student.,6006,6037,Los Angeles County CA
105,CA,Los Angeles,tarzana,2019-03-01,"anti-semitic fliers were discovered at an elementary school that asked ""what is the difference between crackheads and jews?"" a swastika and the message ""the murder of innocent women and children by a rothschild led jewish zionist armed militia to forcibly confiscate the land of palestine now known as israel.""",9616,6037,Los Angeles County CA
106,CA,Los Angeles,van nuys,2019-03-01,a swastika was spray-painted on a school wall.,11706,6037,Los Angeles County CA
107,CA,Los Angeles,west hollywood,2019-11-01,swastika traced into the dust of a car parked in the school parking lot.,12078,6037,Los Angeles County CA
108,CA,Los Angeles,woodland hills,2019-03-01,"anti-semitic fliers were discovered at a high school that asked ""what is the difference between crackheads and jews?"" a swastika and the message ""the murder of innocent women and children by a rothschild led jewish zionist armed militia to forcibly confiscate the land of palestine now known as israel.""",9612,6037,Los Angeles County CA
109,CA,Los Angeles,woodland hills,2019-04-01,a classmate of a jewish student at a middle school drew a swastika on the jewish student's class work.,9689,6037,Los Angeles County CA
110,CA,Marin,kentfield,2018-11-01,anti-semitic symbols etched and painted in boys' bathroom at a middle school.,6901,6041,Marin County CA
111,CA,Marin,kentfield,2019-02-01,"anti-semitic graffiti, likely a swastika, was etched into a desk at kent middle school.",10067,6041,Marin County CA
112,CA,Marin,larkspur,2016-10-01,middle school student had a piece of paper with a swastika drawn on it placed in his backpack during the school day.,1280,6041,Marin County CA
113,CA,Marin,larkspur,2017-05-01,a jewish student harassed with holocaust-related verbiage.,2891,6041,Marin County CA
114,CA,Marin,novato,2019-08-01,at least a dozen anti-semitic fliers were posted at san marin high school that accused jews and israelis of being responsible for the 9/11 terrorist attacks.,9903,6041,Marin County CA
115,CA,Marin,san anselmo,2017-10-01,swastika painted in red on the asphalt at a high school.,2987,6041,Marin County CA
116,CA,Marin,san rafael,2016-12-01,"jewish high school student experienced repeated anti-semitic harassment from classmates, including the nazi salute.",2213,6041,Marin County CA
117,CA,Monterey,monterey,2017-05-01,"a public school teacher has been repeatedly harassed by students yelling ""death to jews"" and ""heil hitler"" outside their classroom, and a swastika was drawn on the whiteboard.",2900,6053,Monterey County CA
118,CA,Orange,garden grove,2019-04-01,student gestured the nazi salute in front of other students that included at least one jewish student.,9691,6059,Orange County CA
119,CA,Orange,garden grove,2019-12-01,jewish student harassed on the basketball court by an opposing player.,12167,6059,Orange County CA
120,CA,Orange,irvine,2017-12-01,jewish middle school student victim of anti-semitic bullying.,3011,6059,Orange County CA
121,CA,Orange,irvine,2019-01-01,"after a high school soccer game at a jewish high school, members of the opposing team gave the nazi salute while walking off the field.",9498,6059,Orange County CA
122,CA,Orange,irvine,2019-09-01,jewish high school student heard classmate making anti-semitic remarks.,9943,6059,Orange County CA
123,CA,Orange,irvine,2019-10-01,"jewish middle school student was shoved by a classmate who told him ""move, jew!""",10581,6059,Orange County CA
124,CA,Orange,irvine,2019-12-01,a high school student was the victim of ongoing anti-semitic holocaust jokes by a classmate.,12229,6059,Orange County CA
125,CA,Orange,laguna beach,2017-05-01,"three fourth grade students sang to a fellow student a song with the words, ""we?re nazi?s and we hate the jews. we?re nazi?s and we are creeping you. we?re nazi?s and we?re killing you. we?e nazi?s and we go (sound of a machine gun.)""",2897,6059,Orange County CA
126,CA,Orange,laguna beach,2017-09-01,elementary school student victim of anti-semitic bullying by a classmate.,2965,6059,Orange County CA
127,CA,Orange,laguna beach,2018-05-01,middle school student shared offensive holocaust-related meme.,6041,6059,Orange County CA
128,CA,Orange,laguna beach,2019-05-01,jewish high school student was harassed with anti-semitic epithets by classmate.,9752,6059,Orange County CA
129,CA,Orange,lake forest,2019-06-01,"a star of david and the word ""juden"" were written on a gym locker at a high school.",10326,6059,Orange County CA
130,CA,Orange,mission viejo,2017-03-01,teacher used racist and anti-semitic language in class.,2824,6059,Orange County CA
131,CA,Orange,newport beach,2019-03-10,a 22-year-old woman neo-nazi and anti-semitic fliers on the newport harbor high school campus.,7566,6059,Orange County CA
132,CA,Orange,san clemente,2018-08-01,anti-semitic graffiti was spray-painted on a several buildings at a middle school.,6374,6059,Orange County CA
133,CA,Orange,santa ana,2019-10-01,"during a group assignment, a non-jewish student directed the nazi salute at a jewish student.",9977,6059,Orange County CA
134,CA,Orange,tustin,2017-11-01,"jewish student harassed at middle school, classmates drew swastikas on their peer-graded assignments in order to intimidate the jewish student.",2993,6059,Orange County CA
135,CA,Orange,tustin,2018-05-01,jewish student at a public high school was subjected to anti-semitic rhetoric by his teacher.,5936,6059,Orange County CA
136,CA,Orange,tustin,2019-09-01,a holocaust joke was directed toward a jewish student at a middle school.,9939,6059,Orange County CA
137,CA,Orange,yorba linda,2018-10-01,jewish student's classwork was defaced by her classmate with a swastika.,6532,6059,Orange County CA
138,CA,Orange,yorba linda,2019-05-01,"a student at a middle school edited a class project with the message ""hitler did nothing wrong.""",9745,6059,Orange County CA
139,CA,Orange,yorba linda,2019-10-01,jewish middle school student was told an anti-semitic joke by a classmate.,9983,6059,Orange County CA
140,CA,Orange,yorba linda,2019-11-01,classmate of jewish high school student drew a swastika in her school folder.,10853,6059,Orange County CA
141,CA,Placer,roseville,2017-08-01,"anti-semitic incident: vandalism including a swastika and the words ""white power"" written at a middle school.",2940,6061,Placer County CA
142,CA,Riverside,indio,2016-10-01,high school student reportedly wore a nazi uniform to school for halloween.,1137,6065,Riverside County CA
143,CA,Riverside,indio,2016-12-01,"jewish high school student who experienced multiple incidents of anti-semitic harassment was told that her ""breath smells like burning jews.""",1138,6065,Riverside County CA
144,CA,Riverside,la quinta,2019-03-01,"a student announced to their class that ""the nazis should have killed all the jews, especially this sub.""",9609,6065,Riverside County CA
145,CA,Riverside,palm desert,2016-11-01,"peers said ""heil hitler"" to jewish middle school girl.",1881,6065,Riverside County CA
146,CA,Riverside,palm springs,2017-01-01,anti-semitic comments overheard in classroom.,2772,6065,Riverside County CA
147,CA,Riverside,palm springs,2017-01-01,jewish student harassed by classmate with anti-semitic language.,2769,6065,Riverside County CA
148,CA,Riverside,riverside,2017-03-01,"white supremacist flyers at high school that read: ""no jews, no problems.""",2856,6065,Riverside County CA
149,CA,Riverside,riverside,2017-08-01,a jewish high school student experienced repeated anti-semitic anti-semitic incident: harassment and bullying by his peers.,2934,6065,Riverside County CA
150,CA,Riverside,wildomar,2016-10-01,"""burn jews,"" the n-word, ""gay,"" ""bitch,"" trump,"" and a drawing of a penis were written on a elementary school wall.",2672,6065,Riverside County CA
151,CA,Riverside,wildomar,2019-03-01,a jewish middle school student was the victim of anti-semitic harassment at school.,9606,6065,Riverside County CA
152,CA,Sacramento,sacramento,2019-05-01,"middle school students yelling ""heil hitler"" and making nazi salute to, or in sight of, jewish students.",9747,6067,Sacramento County CA
153,CA,San Bernardino,la quinta,2019-03-01,"a student announced to their class that ""the nazis should have killed all the jews, especially this sub.""",9609,6071,San Bernardino County CA
154,CA,San Bernardino,redlands,2018-12-01,a seventeen-year-old was arrested for spray-painting a swastika and expletives at clement middle school.,7101,6071,San Bernardino County CA
155,CA,San Diego,bonita,2017-10-01,jewish middle school-aged student victim of ongoing anti-semitic anti-semitic incident: harassment and bullying at school.,2970,6073,San Diego County CA
156,CA,San Diego,carlsbad,2016-10-01,"jewish high school senior called a ""kike"" by classmates and faced multiple incidents of anti-semitic ""jokes.""",460,6073,San Diego County CA
157,CA,San Diego,carlsbad,2019-10-01,a high school was vandalized with swastika graffiti.,10827,6073,San Diego County CA
158,CA,San Diego,el cajon,2016-12-01,"a non-jewish student yelled at a jewish student while playing tetherball: ""you're an asshole you jewish cunt.""",817,6073,San Diego County CA
