adl_id,Description,Type,Nature,Location,Perpetrator,Target,State,County,City,Fips_County,Date,CountyState,population_2010,latitude,longitude,Land_Area,Water_Area,Total_Area
6647,swastika vandalism discovered in school bathroom.,vandalism,nazi,in school,not specified,not specified,NJ,Bergen,hillsdale,34003,10/1/2018,Bergen County NJ,"905,116",40.95909,-74.074522,233.009,13.662,246.671
6395,a swastika and kkk graffiti were discovered in a classroom at a high school.,vandalism,"nazi, oppression connection",in school,not specified,not specified,NJ,Bergen,teaneck,34003,10/1/2018,Bergen County NJ,"905,116",40.95909,-74.074522,233.009,13.662,246.671
6538,jewish student received an anti-semitic meme in a message from a classmate.,cyberbullying,general antisemitism,social media,student,student,NJ,Camden,cherry hill,34007,10/1/2018,Camden County NJ,"513,657",39.802352,-74.961251,221.263,6.03,227.293
6612,student drew a swastika in the bathroom using feces.,vandalism,nazi,in school,student,not specified,NJ,Camden,haddonfield,34007,10/1/2018,Camden County NJ,"513,657",39.802352,-74.961251,221.263,6.03,227.293
6544,"a swastika, the word kike, and the n-word were spray-painted on a wall at a high school.",vandalism,"general antisemitism, nazi, oppression connection",in school,not specified,not specified,NJ,Union,scotch plains,34039,10/1/2018,Union County NJ,"536,499",40.659871,-74.308696,102.855,2.546,105.401
6542,"vandalism that included swastikas, the word kike, the n-word, and kkk were discovered at a school.",vandalism,"general antisemitism, nazi, oppression connection",in school,not specified,not specified,NJ,Union,scotch plains,34039,10/1/2018,Union County NJ,"536,499",40.659871,-74.308696,102.855,2.546,105.401
6648,swastika vandalism discovered in school bathroom.,vandalism,nazi,in school,not specified,not specified,NJ,Union,westfield,34039,10/1/2018,Union County NJ,"536,499",40.659871,-74.308696,102.855,2.546,105.401
6649,swastika vandalism discovered in school bathroom.,vandalism,nazi,in school,not specified,not specified,NY,Sullivan,monticello,36105,10/1/2018,Sullivan County NY,"77,547",41.720176,-74.76468,968.132,28.591,996.723
6543,"students at a high school gave the ""heil hitler"" salute in class.",performance,nazi,in school,student,not specified,NY,Sullivan,monticello,36105,10/1/2018,Sullivan County NY,"77,547",41.720176,-74.76468,968.132,28.591,996.723
6671,flyers for the jewish student union at a public high school were defaced with hateful words.,vandalism,general antisemitism,in school,not specified,not specified,OR,Multnomah,portland,41051,10/1/2018,Multnomah County OR,"735,334",45.547693,-122.41717299999999,431.297,34.306,465.603
6645,anti-semitic and racist graffiti spray-painted on the walls of a middle school.,vandalism,"general antisemitism, oppression connection",in school,not specified,not specified,PA,Bucks,levittown,42017,10/1/2018,Bucks County PA,"625,249",40.336887,-75.10706,604.307,17.567,621.874
6643,anti-semitic and racist graffiti spray-painted on the exterior walls of a middle school.,vandalism,"general antisemitism, oppression connection",outside school,not specified,not specified,PA,Bucks,levittown,42017,10/1/2018,Bucks County PA,"625,249",40.336887,-75.10706,604.307,17.567,621.874
6529,"jewish student received message saying ""stfu, kike!""",harassment,general antisemitism,social media,not specified,student,TX,Bexar,san antonio,48029,10/1/2018,Bexar County TX,"1,714,773",29.448671,-98.520147,"1,239.82",16.266,"1,256.09"
6507,"middle school student bullied by another student who disparagingly called him ""jewy.""",harassment,general antisemitism,not specified,student,student,UT,Salt Lake,bluffdale,49035,10/1/2018,Salt Lake County UT,"1,029,655",40.667882,-111.92424399999999,742.282,65.085,807.367
6599,a swastika was carved into a table in a classroom.,vandalism,nazi,in school,not specified,not specified,VT,Lamoille,stowe,50015,10/1/2018,Lamoille County VT,"24,475",44.603504,-72.638356,458.797,4.889,463.686
6518,"students at a high school published a newsletter called ""the money jew"" that was filled with anti-semitic propaganda.",harassment,"general antisemitism, money",publication,student,not specified,WA,King,seattle,53033,10/1/2018,King County WA,"1,931,249",47.493553999999996,-121.832375,"2,115.57",191.303,"2,306.87"
6611,a school desk was vandalized with swastika graffiti.,vandalism,nazi,in school,not specified,not specified,WA,King,seattle,53033,10/1/2018,King County WA,"1,931,249",47.493553999999996,-121.832375,"2,115.57",191.303,"2,306.87"
4823,"a daily stormer book club, an alt right group, distributed flyers at maybeck high school. the flyers read: ""every time some anti-white, anti-america, anti-freedom event takes place, you look at it, and it's jews behind it.""",literature dump,general antisemitism,in school,outsider,not specified,CA,Alameda,berkeley,6001,10/8/2018,Alameda County CA,"1,510,271",37.648081,-121.91330400000001,739.017,82.311,821.328
6763,"jewish boy verbally harassed by classmates who called him a ""penny-pincher jew,"" among other things.",harassment,"general antisemitism, money",not specified,student,student,CA,Contra Costa,el cerrito,6013,11/1/2018,Contra Costa County CA,"1,049,025",37.919478999999995,-121.95154299999999,715.937,87.833,803.77
6901,anti-semitic symbols etched and painted in boys' bathroom at a middle school.,vandalism,general antisemitism,in school,not specified,not specified,CA,Marin,kentfield,6041,11/1/2018,Marin County CA,"252,409",38.051817,-122.745974,520.306,307.886,828.192
6910,middle school defaced with swastika graffiti.,vandalism,nazi,in school,not specified,not specified,CA,San Diego,el cajon,6073,11/1/2018,San Diego County CA,"3,095,313",33.023604,-116.776117,"4,206.63",319.055,"4,525.69"
6820,anti-semitic graffiti discovered at an elementary school.,vandalism,general antisemitism,in school,not specified,not specified,CA,San Diego,san diego,6073,11/1/2018,San Diego County CA,"3,095,313",33.023604,-116.776117,"4,206.63",319.055,"4,525.69"
6799,"jewish high school student victim of anti-semitic harassment and bullying that included anti-semitic jokes and being physically labeled ""jew.""",harassment,general antisemitism,not specified,student,student,CA,Solano,fairfield,6095,11/1/2018,Solano County CA,"413,344",38.267226,-121.939594,821.765,84.427,906.192
6890,"graffiti that read: ""burn the jews"" was written on an elementary school playground.",vandalism,nazi,outside school,not specified,not specified,CO,Adams,aurora,8001,11/1/2018,Adams County CO,"441,603",39.874325,-104.331872,"1,167.65",16.243,"1,183.90"
6867,"anti-semitic, racist and homophobic vandalism discovered in a bathroom at eaglecrest high school.",vandalism,"general antisemitism, oppression connection",in school,not specified,not specified,CO,Adams,aurora,8001,11/1/2018,Adams County CO,"441,603",39.874325,-104.331872,"1,167.65",16.243,"1,183.90"
6714,anti-semitic harassment in school.,harassment,general antisemitism,in school,not specified,not specified,CO,Arapahoe,cherry hills village,8005,11/1/2018,Arapahoe County CO,"572,003",39.644632,-104.331733,798.1,7.337,805.437
6939,swastika graffiti discovered at a middle school.,vandalism,nazi,in school,not specified,not specified,CO,Jefferson,conifer,8059,11/1/2018,Jefferson County CO,"534,543",39.586459999999995,-105.24560100000001,764.208,9.825,774.033
6711,"a student used the word ""jew"" in a disparaging way to insult another student.",harassment,general antisemitism,not specified,student,student,CO,Larimer,fort collins,8069,11/1/2018,Larimer County CO,"299,630",40.663090999999994,-105.48213100000001,"2,596.00",37.952,"2,633.95"
6712,"during class, a student called out: ""i call upon jesus to kill all jews.""",harassment,general antisemitism,in school,student,not specified,CO,Larimer,fort collins,8069,11/1/2018,Larimer County CO,"299,630",40.663090999999994,-105.48213100000001,"2,596.00",37.952,"2,633.95"
6843,swastika vandalism discovered in a middle school.,vandalism,nazi,in school,not specified,not specified,CT,Fairfield,darien,9001,11/1/2018,Fairfield County CT,"916,829",41.228103000000004,-73.36675699999999,624.89,212.033,836.923
6715,"image advertising something at a school was edited to read ""save a turkey roast a jew.""",vandalism,nazi,in school,not specified,not specified,CT,Fairfield,trumbull,9001,11/1/2018,Fairfield County CT,"916,829",41.228103000000004,-73.36675699999999,624.89,212.033,836.923
6713,jewish student discovered someone had left a swastika image on her desk and a fellow student made a disparaging comment about jews to her.,"vandalism, harassment","general antisemitism, nazi",in school,not specified,student,CT,Hartford,west hartford,9003,11/1/2018,Hartford County CT,"894,014",41.806053000000006,-72.732916,735.097,15.527,750.624
6846,swastika graffiti discovered at a high school.,vandalism,nazi,in school,not specified,not specified,CT,New Haven,woodbridge,9009,11/1/2018,New Haven County CT,"862,477",41.349717,-72.900204,604.506,257.551,862.057
7577,swastika graffiti discovered at a k-12 private school.,vandalism,nazi,in school,not specified,not specified,DC,District of Columbia,washington,11001,11/1/2018,District of Columbia County DC,"601,723",38.904149,-77.017094,61.048,7.292,68.34
6885,swastika graffiti discovered in a middle school.,vandalism,nazi,in school,not specified,not specified,FL,Hillsborough,tampa,12057,11/1/2018,Hillsborough County FL,"1,229,226",27.90659,-82.349568,"1,020.21",245.551,"1,265.77"
6770,"jewish middle school student bullied my other students who called him ""jew boy"" and ""dumb jewish kid.""",harassment,general antisemitism,not specified,student,student,FL,Leon,tallahassee,12073,11/1/2018,Leon County FL,"275,487",30.45931,-84.2778,666.852,34.937,701.789
6823,jewish boy at a middle school discovered a swastika had been drawn on his school locker.,vandalism,nazi,in school,not specified,student,IL,Cook,chicago,17031,11/1/2018,Cook County IL,"5,194,675",41.894294,-87.645455,945.326,689.533,"1,634.86"
6844,"anti-semitic and racist graffiti written in a bathroom at a school that included a swastika and the message: ""gas the jews.""",vandalism,"general antisemitism, nazi, oppression connection",in school,not specified,not specified,IL,Cook,oak park,17031,11/1/2018,Cook County IL,"5,194,675",41.894294,-87.645455,945.326,689.533,"1,634.86"
6755,an image of a swastika was sent to mostly jewish students via apple airdrop.,cyberbullying,nazi,social media,not specified,student,IL,Cook,oak park,17031,11/1/2018,Cook County IL,"5,194,675",41.894294,-87.645455,945.326,689.533,"1,634.86"
6896,swastika graffiti discovered in the bathroom at a high school.,vandalism,nazi,in school,not specified,not specified,IL,Cook,river forest,17031,11/1/2018,Cook County IL,"5,194,675",41.894294,-87.645455,945.326,689.533,"1,634.86"
6788,school peer drew a swastika on a piece of paper in front of jewish classmate.,vandalism,nazi,in school,student,student,LA,Orleans Parish,new orleans,22071,11/1/2018,Orleans County LA,"343,829",30.068635999999998,-89.93900699999999,169.423,180.789,350.212
6895,a number of swastikas were discovered in a high school over the course of two weeks.,vandalism,nazi,in school,not specified,not specified,MA,Essex,boxford,25009,11/1/2018,Essex County MA,"743,159",42.642711,-70.865107,492.563,335.911,828.474
6897,swastika vandalism discovered in a high school bathroom.,vandalism,nazi,in school,not specified,not specified,MA,Essex,boxford,25009,11/1/2018,Essex County MA,"743,159",42.642711,-70.865107,492.563,335.911,828.474
6894,swastika vandalism discovered in a high school bathroom.,vandalism,nazi,in school,not specified,not specified,MA,Essex,boxford,25009,11/1/2018,Essex County MA,"743,159",42.642711,-70.865107,492.563,335.911,828.474
6898,swastika vandalism discovered in a high school bathroom.,vandalism,nazi,in school,not specified,not specified,MA,Essex,boxford,25009,11/1/2018,Essex County MA,"743,159",42.642711,-70.865107,492.563,335.911,828.474
6827,swastika vandalism discovered in an elevator at a high school.,vandalism,nazi,in school,not specified,not specified,MA,Middlesex,malden,25017,11/1/2018,Middlesex County MA,"1,503,085",42.479477,-71.396507,817.817,29.243,847.06
6828,swastika vandalism discovered in a bathroom at a middle school.,vandalism,nazi,in school,not specified,not specified,MA,Middlesex,melrose,25017,11/1/2018,Middlesex County MA,"1,503,085",42.479477,-71.396507,817.817,29.243,847.06
6839,swastika graffiti discovered in a bathroom at a high school.,vandalism,nazi,in school,not specified,not specified,MA,Middlesex,reading,25017,11/1/2018,Middlesex County MA,"1,503,085",42.479477,-71.396507,817.817,29.243,847.06
6838,swastika graffiti discovered in a stairwell at a high school.,vandalism,nazi,in school,not specified,not specified,MA,Middlesex,reading,25017,11/1/2018,Middlesex County MA,"1,503,085",42.479477,-71.396507,817.817,29.243,847.06
6906,racist and anti-semitic graffiti discovered in a middle school.,vandalism,"general antisemitism, oppression connection",in school,not specified,not specified,MA,Norfolk,needham,25021,11/1/2018,Norfolk County MA,"670,850",42.169703000000005,-71.179875,396.105,48.241,444.346
6701,"student was disparagingly referred to as ""jewboy"" by student of opposing sports team.",harassment,general antisemitism,school event,student,student,MA,Norfolk,sharon,25021,11/1/2018,Norfolk County MA,"670,850",42.169703000000005,-71.179875,396.105,48.241,444.346
6934,swastika graffiti discovered in the bathroom of a school.,vandalism,nazi,in school,not specified,not specified,MA,Suffolk,boston,25025,11/1/2018,Suffolk County MA,"722,023",42.331959999999995,-71.020173,58.154,62.065,120.219
6935,swastika vandalism discovered in a bathroom at a prep school.,vandalism,nazi,in school,not specified,not specified,MA,Suffolk,boston,25025,11/1/2018,Suffolk County MA,"722,023",42.331959999999995,-71.020173,58.154,62.065,120.219
6800,a swastika was drawn on a student's notebook.,vandalism,nazi,in school,not specified,student,MA,Suffolk,boston,25025,11/1/2018,Suffolk County MA,"722,023",42.331959999999995,-71.020173,58.154,62.065,120.219
6887,swastikas and a star of david were drawn in a bathroom at a high school.,vandalism,"general antisemitism, nazi",in school,not specified,not specified,ME,Cumberland,cumberland,23005,11/1/2018,Cumberland County ME,"281,674",43.808347999999995,-70.330375,835.241,382.222,"1,217.46"
6809,jewish high school student was taunted by peers with an anti-semitic song.,harassment,general antisemitism,not specified,student,student,MI,Oakland,bloomfield hills,26125,11/1/2018,Oakland County MI,"1,202,362",42.660452,-83.38421,867.663,39.631,907.294
6735,"a jewish student was called a ""dirty jew"" by a classmate.",harassment,general antisemitism,not specified,student,student,NC,Mecklenburg,charlotte,37119,11/1/2018,Mecklenburg County NC,"919,628",35.246862,-80.833832,523.842,22.067,545.909
6754,"student drew a swastika and wrote ""dirty jew"" on another student's homework.",vandalism,"general antisemitism, nazi",in school,student,student,NE,Lancaster,lincoln,31109,11/1/2018,Lancaster County NE,"285,407",40.783547,-96.68865799999999,837.548,8.833,846.381
6847,swastika and racist vandalism discovered in a school bathroom.,vandalism,"nazi, oppression connection",in school,not specified,not specified,NJ,Bergen,hillsdale,34003,11/1/2018,Bergen County NJ,"905,116",40.95909,-74.074522,233.009,13.662,246.671
6848,swastika vandalism discovered in school bathroom.,vandalism,nazi,in school,not specified,not specified,NJ,Bergen,hillsdale,34003,11/1/2018,Bergen County NJ,"905,116",40.95909,-74.074522,233.009,13.662,246.671
3476,jungle gym equipment at a middle school was defaced with swastika graffiti.,vandalism,nazi,outside school,not specified,not specified,NJ,Bergen,north arlington,34003,11/1/2018,Bergen County NJ,"905,116",40.95909,-74.074522,233.009,13.662,246.671
6539,"a swastika and the letters ""wp,"" presumably ""white power,"" were scratched into a bathroom stall at a school.",vandalism,"nazi, oppression connection",in school,not specified,not specified,NJ,Bergen,woodcliff lake,34003,11/1/2018,Bergen County NJ,"905,116",40.95909,-74.074522,233.009,13.662,246.671
6854,school desk vandalized with swastika graffiti.,vandalism,nazi,in school,not specified,not specified,NJ,Essex,livingston,34013,11/1/2018,Essex County NJ,"783,969",40.787217,-74.24613599999999,126.212,3.419,129.631
2356,a student drew a swastika in the book of another student.,vandalism,nazi,in school,student,student,NJ,Sussex,stanhope,34037,11/1/2018,Sussex County NJ,"149,265",41.137423999999996,-74.691855,519.014,16.729,535.743
7080,three swastika drawings were discovered on the wall in a bathroom at a middle school.,vandalism,nazi,in school,not specified,not specified,NJ,Union,summit,34039,11/1/2018,Union County NJ,"536,499",40.659871,-74.308696,102.855,2.546,105.401
6852,swastika vandalism discovered in school bathroom.,vandalism,nazi,in school,not specified,not specified,NJ,Union,summit,34039,11/1/2018,Union County NJ,"536,499",40.659871,-74.308696,102.855,2.546,105.401
7082,a swastika and the n-word were drawn in a bathroom at a middle school.,vandalism,"nazi, oppression connection",in school,not specified,not specified,NJ,Union,summit,34039,11/1/2018,Union County NJ,"536,499",40.659871,-74.308696,102.855,2.546,105.401
6851,swastika graffiti discovered in a middle school bathroom.,vandalism,nazi,in school,not specified,not specified,NJ,Union,summit,34039,11/1/2018,Union County NJ,"536,499",40.659871,-74.308696,102.855,2.546,105.401
7088,four swastikas were drawn in a bathroom at a high school.,vandalism,nazi,in school,not specified,not specified,NJ,Union,summit,34039,11/1/2018,Union County NJ,"536,499",40.659871,-74.308696,102.855,2.546,105.401
7085,a swastika was drawn in the bathroom at a middle school.,vandalism,nazi,in school,not specified,not specified,NJ,Union,summit,34039,11/1/2018,Union County NJ,"536,499",40.659871,-74.308696,102.855,2.546,105.401
6933,"a school was vandalized with swastikas, kkk, and the n-word graffiti.",vandalism,"nazi, oppression connection",in school,not specified,not specified,NJ,Union,westfield,34039,11/1/2018,Union County NJ,"536,499",40.659871,-74.308696,102.855,2.546,105.401
6850,road outside binghamton high school was vandalized with swastika graffiti. swastika graffiti also found on school windows.,vandalism,nazi,outside school,not specified,not specified,NY,Broome,binghamton,36007,11/1/2018,Broome County NY,"200,600",42.161977,-75.830291,705.766,9.749,715.515
6950,"swastikas and ""nazi"" found written on the front of a teacher's desk at a school.",vandalism,nazi,in school,not specified,not specified,NY,New York,new york,36061,11/1/2018,New York County NY,"1,585,873",40.776557000000004,-73.970174,22.829,10.762,33.591
6918,five swastikas found by custodian at a charter school in west harlem.,vandalism,nazi,in school,not specified,not specified,NY,New York,new york,36061,11/1/2018,New York County NY,"1,585,873",40.776557000000004,-73.970174,22.829,10.762,33.591
6947,swastika found on the bathroom stall of a boys restroom at a school.,vandalism,nazi,in school,not specified,not specified,NY,Queens,long island city,36081,11/1/2018,Queens County NY,"2,230,722",40.658557,-73.837929,108.532,69.675,178.207
6722,middle school student made anti-semitic comment.,harassment,general antisemitism,not specified,student,not specified,NY,Sullivan,monticello,36105,11/1/2018,Sullivan County NY,"77,547",41.720176,-74.76468,968.132,28.591,996.723
6721,doctored anti-semitic snapchat photo of a student was circulated throughout school.,cyberbullying,general antisemitism,social media,not specified,student,NY,Sullivan,monticello,36105,11/1/2018,Sullivan County NY,"77,547",41.720176,-74.76468,968.132,28.591,996.723
6826,school vandalized with swastika graffiti.,vandalism,nazi,in school,not specified,not specified,NY,Tioga,apalachin,36107,11/1/2018,Tioga County NY,"51,125",42.178057,-76.29745,518.602,4.278,522.88
6845,swastika vandalism discovered in high school locker room.,vandalism,nazi,in school,not specified,not specified,NY,Westchester,new rochelle,36119,11/1/2018,Westchester County NY,"949,113",41.152770000000004,-73.745912,430.497,69.498,499.995
6849,swastika vandalism discovered in school locker room.,vandalism,nazi,in school,not specified,not specified,NY,Westchester,rye,36119,11/1/2018,Westchester County NY,"949,113",41.152770000000004,-73.745912,430.497,69.498,499.995
6909,elementary school defaced with swastika graffiti.,vandalism,nazi,in school,not specified,not specified,OR,Multnomah,portland,41051,11/1/2018,Multnomah County OR,"735,334",45.547693,-122.41717299999999,431.297,34.306,465.603
6767,high school students shared an anti-semitic video on snapchat targeting other students.,cyberbullying,general antisemitism,social media,student,student,PA,Lehigh,allentown,42077,11/1/2018,Lehigh County PA,"349,497",40.614241,-75.590627,345.166,3.073,348.239
6719,"an anti-semitic flier was discovered in a middle school. it read: ""stop fighting for jewish lies and fight a real war to save your race!""",literature dump,"general antisemitism, oppression connection",in school,not specified,not specified,PA,Philadelphia,philadelphia,42101,11/1/2018,Philadelphia County PA,"1,526,006",40.009376,-75.133346,134.101,8.606,142.707
6801,"student yelled ""heil hitler all jews should die"" in school.",harassment,nazi,in school,student,not specified,UT,Salt Lake,millcreek,49035,11/1/2018,Salt Lake County UT,"1,029,655",40.667882,-111.92424399999999,742.282,65.085,807.367
6737,"students received notifications for hotspot networks that were anti-semitic, discriminatory, and racist.",cyberbullying,"general antisemitism, oppression connection",in school,not specified,student,WA,Snohomish,snohomish,53061,11/1/2018,Snohomish County WA,"713,335",48.054913,-121.76641200000002,"2,087.27",109.024,"2,196.30"
6727,anti-semitic harassment on school bus.,harassment,general antisemitism,outside school,not specified,not specified,WI,Milwaukee,milwaukee,55079,11/1/2018,Milwaukee County WI,"947,735",43.017655,-87.481575,241.402,948.137,"1,189.54"
7065,swastika graffiti discovered in a stairwell at a high school.,vandalism,nazi,in school,not specified,not specified,AZ,Maricopa,phoenix,4013,12/1/2018,Maricopa County AZ,"3,817,117",33.346540999999995,-112.495534,"9,200.14",24.246,"9,224.39"
7024,jewish high school student victim of anti-semitic harassment and bullying in school by classmate.,harassment,general antisemitism,in school,student,student,AZ,Maricopa,scottsdale,4013,12/1/2018,Maricopa County AZ,"3,817,117",33.346540999999995,-112.495534,"9,200.14",24.246,"9,224.39"
7005,"anti-semitic note left at a school that included the words ""fake ass jew.""",harassment,general antisemitism,in school,not specified,not specified,CA,Los Angeles,los angeles,6037,12/1/2018,Los Angeles County CA,"9,818,605",34.196397999999995,-118.26186200000001,"4,057.88",693.058,"4,750.94"
7101,a seventeen-year-old was arrested for spray-painting a swastika and expletives at clement middle school.,vandalism,nazi,in school,student,not specified,CA,San Bernardino,redlands,6071,12/1/2018,San Bernardino County CA,"2,035,210",34.85722,-116.181197,"20,056.94",47.888,"20,104.83"
7068,swastika graffiti discovered in a bathroom stall at a school.,vandalism,nazi,in school,not specified,not specified,CT,Fairfield,westport,9001,12/1/2018,Fairfield County CT,"916,829",41.228103000000004,-73.36675699999999,624.89,212.033,836.923
6974,jewish middle school student verbally harassed by classmate who made remarks praising hitler for killing jews and threatened to kill jews himself.,harassment,nazi,not specified,student,student,FL,Martin,stuart,12085,12/1/2018,Martin County FL,"146,318",27.079953999999997,-80.398211,543.464,209.365,752.829
7066,"""hail hitler"" and an image of a swastika were written in a bathroom stall at a high school.",vandalism,nazi,in school,not specified,not specified,FL,Palm Beach,boca raton,12099,12/1/2018,Palm Beach County FL,"1,320,134",26.645763,-80.448673,"1,969.76",413.246,"2,383.01"
7124,a swastika was etched into a bathroom stall at a high school.,vandalism,nazi,in school,not specified,not specified,FL,Palm Beach,boca raton,12099,12/1/2018,Palm Beach County FL,"1,320,134",26.645763,-80.448673,"1,969.76",413.246,"2,383.01"
7019,"orthodox jewish teacher was told by one of her students, ""i hate jews. i'm in the nation of islam and i don't like jews,"" and was repeatedly harassed with anti-semitic comments by other students.",harassment,general antisemitism,in school,student,teacher,IL,Cook,chicago,17031,12/1/2018,Cook County IL,"5,194,675",41.894294,-87.645455,945.326,689.533,"1,634.86"
6976,jewish student victim of anti-semitic bullying.,harassment,general antisemitism,not specified,student,student,LA,Jefferson Parish,westwego,22051,12/1/2018,Jefferson County LA,"432,552",29.5033,-90.036231,295.632,369.791,665.423
7027,jewish boy victim of anti-semitic harassment by other students at his gymnasium.,harassment,general antisemitism,in school,student,student,MA,Hampden,agawam,25013,12/1/2018,Hampden County MA,"463,490",42.136198,-72.635648,617.14,17.111,634.251
7014,jewish students were verbally harassed and called anti-semitic names on the school bus.,harassment,general antisemitism,outside school,not specified,student,MA,Hampden,east longmeadow,25013,12/1/2018,Hampden County MA,"463,490",42.136198,-72.635648,617.14,17.111,634.251
7029,a swastika was taped to the back of a student at a high school.,vandalism,nazi,in school,not specified,student,MA,Hampshire,amherst,25015,12/1/2018,Hampshire County MA,"158,080",42.339459000000005,-72.66369399999999,527.255,17.954,545.209
