adl_id,Description,Type,Nature,Location,Perpetrator,Target,State,County,City,Fips_County,Date,CountyState,population_2010,latitude,longitude,Land_Area,Water_Area,Total_Area
9612,"anti-semitic fliers were discovered at a high school that asked ""what is the difference between crackheads and jews?"" a swastika and the message ""the murder of innocent women and children by a rothschild led jewish zionist armed militia to forcibly confiscate the land of palestine now known as israel.""",literature dump,"general antisemitism, nazi, israel, conspiracy",in school,not specified,not specified,CA,Los Angeles,woodland hills,6037,3/1/2019,Los Angeles County CA,"9,818,605",34.196397999999995,-118.26186200000001,"4,057.88",693.058,"4,750.94"
9609,"a student announced to their class that ""the nazis should have killed all the jews, especially this sub.""",harassment,nazi,in school,student,teacher,CA,Riverside,la quinta,6065,3/1/2019,Riverside County CA,"2,189,641",33.729828000000005,-116.00223899999999,"7,206.48",96.94,"7,303.42"
9606,a jewish middle school student was the victim of anti-semitic harassment at school.,harassment,general antisemitism,in school,not specified,student,CA,Riverside,wildomar,6065,3/1/2019,Riverside County CA,"2,189,641",33.729828000000005,-116.00223899999999,"7,206.48",96.94,"7,303.42"
9599,"person using a loudspeaker shouting anti-israel and anti-semitic slurs from a car outside a hebrew language school, across the street from a local mosque.",harassment,"general antisemitism, israel",outside school,outsider,school,CA,San Diego,san diego,6073,3/1/2019,San Diego County CA,"3,095,313",33.023604,-116.776117,"4,206.63",319.055,"4,525.69"
11688,"at a high school, a wifi hotspot was named with five swastika images and visible to those in the vicinity.",vandalism,nazi,in school,not specified,not specified,CA,San Diego,san diego,6073,3/1/2019,San Diego County CA,"3,095,313",33.023604,-116.776117,"4,206.63",319.055,"4,525.69"
10121,"the name of a black student at vanden high school was spray-apinted on a sports field at the school along with a swastika, racial slurs, and ""usa for trump.""",vandalism,"nazi, oppression connection",outside school,not specified,student,CA,Solano,fairfield,6095,3/1/2019,Solano County CA,"413,344",38.267226,-121.939594,821.765,84.427,906.192
9622,jewish student target of anti-semitic verbal harassment by another student.,harassment,general antisemitism,not specified,student,student,CO,Arapahoe,centennial,8005,3/1/2019,Arapahoe County CO,"572,003",39.644632,-104.331733,798.1,7.337,805.437
9623,a non-jewish student did the hitler salute at a jewish student.,performance,nazi,not specified,student,student,CT,Middlesex,cromwell,9007,3/1/2019,Middlesex County CT,"165,676",41.434525,-72.524227,369.301,69.762,439.063
9625,a swastika was drawn on a student's homework assignment.,vandalism,nazi,in school,not specified,student,CT,New Haven,hamden,9009,3/1/2019,New Haven County CT,"862,477",41.349717,-72.900204,604.506,257.551,862.057
9677,students used swastikas as usernames during an online school assembly.,cyberbullying,nazi,social media,student,not specified,DC,District of Columbia,washington,11001,3/1/2019,District of Columbia County DC,"601,723",38.904149,-77.017094,61.048,7.292,68.34
9628,"a student chanted ""heil hitler"" at a jewish student.",harassment,nazi,not specified,student,student,FL,Alachua,gainesville,12001,3/1/2019,Alachua County FL,"247,336",29.67574,-82.357221,875.02,93.788,968.808
9630,"two hateful videos at whitney young high school were circulated to students, one of which showed student talking to another on facetime, as someone behind the girl holds a swastika.",cyberbullying,nazi,social media,student,student,IL,Cook,chicago,17031,3/1/2019,Cook County IL,"5,194,675",41.894294,-87.645455,945.326,689.533,"1,634.86"
9631,"ongoing anti-semitic harassment of a boy in a junior high school by his peers, that included anti-semitic messages sent via snapchat.",harassment,general antisemitism,social media,student,student,IL,Cook,orland park,17031,3/1/2019,Cook County IL,"5,194,675",41.894294,-87.645455,945.326,689.533,"1,634.86"
10132,"a swastika and the message, ""i hate minorities"" was written on the walls and lockers at a high school.",vandalism,"nazi, oppression connection",in school,not specified,not specified,IL,McLean,normal,17113,3/1/2019,McLean County IL,"169,572",40.494559,-88.844539,"1,183.38",2.892,"1,186.27"
9633,"jewish student was bullied by peers at school who told him to ""go back to the concentration camps.",harassment,nazi,in school,student,student,LA,Lafayette Parish,lafayette,22055,3/1/2019,Lafayette County LA,"221,578",30.206507000000002,-92.06416999999999,268.72,0.489,269.209
9635,a student at a middle school made anti-semitic remarks to a jewish student about gas chambers.,harassment,nazi,in school,student,student,MA,Essex,swampscott,25009,3/1/2019,Essex County MA,"743,159",42.642711,-70.865107,492.563,335.911,828.474
10135,graffiti that included a swastika and an expletive was discovered in a bathroom at bannockburn elementary school.,vandalism,nazi,in school,not specified,not specified,MD,Montgomery,bethesda,24031,3/1/2019,Montgomery County MD,"971,777",39.137382,-77.203063,491.254,15.693,506.947
9634,"during a spanish class at a middle school, the teacher told the class that ""the jews killed jesus"" because ""that's just what the catholics and christians believe.""",harassment,general antisemitism,in school,teacher,not specified,MD,Montgomery,silver spring,24031,3/1/2019,Montgomery County MD,"971,777",39.137382,-77.203063,491.254,15.693,506.947
10172,five swastikas were drawn with a marker on a bulletin board and a shower curtain at a high school.,vandalism,nazi,in school,not specified,not specified,NC,Durham,durham,37063,3/1/2019,Durham County NC,"267,587",36.036589,-78.87791899999999,285.975,11.891,297.866
10144,anti-semitic and anti-black graffiti was written on bathroom stalls at dwight-engelwood school.,vandalism,"general antisemitism, oppression connection",in school,not specified,not specified,NJ,Bergen,englewood,34003,3/1/2019,Bergen County NJ,"905,116",40.95909,-74.074522,233.009,13.662,246.671
10142,"a bathroom at a high school was defaced with racist and anti-semitic graffiti that included a swastika, the word ""jews"" with a circle and line through it, the n-word, and ""wp"" for white power.",vandalism,"general antisemitism, nazi, oppression connection",in school,not specified,not specified,NJ,Bergen,montvale,34003,3/1/2019,Bergen County NJ,"905,116",40.95909,-74.074522,233.009,13.662,246.671
11699,jewish student victim of anti-semitic harassment and bullying by a peer.,harassment,general antisemitism,not specified,student,student,NJ,Burlington,medford,34005,3/1/2019,Burlington County NJ,"448,734",39.875786,-74.66300600000001,798.576,21.262,819.838
11694,a school employee discovered that two swastikas had been drawn on the sheet rock in a bathroom.,vandalism,nazi,in school,not specified,not specified,NJ,Monmouth,holmdel,34025,3/1/2019,Monmouth County NJ,"630,380",40.287056,-74.152446,468.793,196.527,665.32
11701,"""i hate jews"" found written on a library desk at a high school.",vandalism,general antisemitism,in school,not specified,not specified,NJ,Monmouth,holmdel,34025,3/1/2019,Monmouth County NJ,"630,380",40.287056,-74.152446,468.793,196.527,665.32
10143,"two bathrooms at high point regional high school were vandalized with swastika etchings and messages that read ""kill the jews"" and ""hitler was here.""",vandalism,nazi,in school,not specified,not specified,NJ,Sussex,sussex,34037,3/1/2019,Sussex County NJ,"149,265",41.137423999999996,-74.691855,519.014,16.729,535.743
10557,a non-jewish student at a middle school slapped a jewish student because she was jewish.,harassment,general antisemitism,in school,student,student,NY,Nassau,great neck,36059,3/1/2019,Nassau County NY,"1,339,532",40.729687,-73.589384,284.716,168.518,453.234
9648,two students at division avenue high schoolphoto-shoppeda screen shot of the school district's website with anti-semitic messages and shared it with people in a group chat.,cyberbullying,general antisemitism,social media,student,not specified,NY,Nassau,levittown,36059,3/1/2019,Nassau County NY,"1,339,532",40.729687,-73.589384,284.716,168.518,453.234
11698,"over the course of a week, swastika vandalism was discovered at multiple locations in a middle school.",vandalism,nazi,in school,not specified,not specified,NY,Westchester,new rochelle,36119,3/1/2019,Westchester County NY,"949,113",41.152770000000004,-73.745912,430.497,69.498,499.995
10145,swastika vandalism discovered at a middle school.,vandalism,nazi,in school,not specified,not specified,NY,Westchester,new rochelle,36119,3/1/2019,Westchester County NY,"949,113",41.152770000000004,-73.745912,430.497,69.498,499.995
9666,"during a verbal altercation between jewish students and catholic adults, one of the adults called the jewish students ""kikes.""",harassment,general antisemitism,not specified,outsider,student,PA,Delaware,bryn mawr,42045,3/1/2019,Delaware County PA,"558,979",39.91667,-75.398786,183.843,6.76,190.603
9664,a group of orthodox jews waiting for a school bus were harassed by individuals in a car that had a palestinian flag displayed on it.,harassment,general antisemitism,off-campus,outsider,student,PA,Philadelphia,philadelphia,42101,3/1/2019,Philadelphia County PA,"1,526,006",40.009376,-75.133346,134.101,8.606,142.707
10179,a bench at a school was vandalized with a swastika carving.,vandalism,nazi,in school,not specified,not specified,PA,Philadelphia,philadelphia,42101,3/1/2019,Philadelphia County PA,"1,526,006",40.009376,-75.133346,134.101,8.606,142.707
9670,jewish elementary school student was verbally harassed by a non-jewish student who made anti-semitic comments.,harassment,general antisemitism,not specified,student,student,TN,Shelby,germantown,47157,3/1/2019,Shelby County TN,"927,644",35.183794,-89.895397,763.174,21.844,785.018
9682,"a jewish middle school student was asked by a classmate if he is jewish, when he said yes the classmate said that he hated him.",harassment,general antisemitism,not specified,student,student,WI,Waukesha,waukesha,55133,3/1/2019,Waukesha County WI,"389,891",43.019308,-88.30670699999999,549.574,31.022,580.596
7566,a 22-year-old woman neo-nazi and anti-semitic fliers on the newport harbor high school campus.,literature dump,"nazi, general antisemitism",outside school,outsider,not specified,CA,Orange,newport beach,6059,3/10/2019,Orange County CA,"3,010,232",33.675686999999996,-117.777207,790.568,157.498,948.066
9598,"folks front, a neo-nazi group, distributed anti-semitic fliers that featured a swastika at perry high school.",literature dump,nazi,in school,outsider,not specified,AZ,Maricopa,gilbert,4013,3/11/2019,Maricopa County AZ,"3,817,117",33.346540999999995,-112.495534,"9,200.14",24.246,"9,224.39"
10190,"anti-semitic graffiti that included the words ""das juden"" and a swastika were spray-painted on an exterior wall at an elementary school.",vandalism,nazi,outside school,not specified,not specified,CA,Los Angeles,los angeles,6037,4/1/2019,Los Angeles County CA,"9,818,605",34.196397999999995,-118.26186200000001,"4,057.88",693.058,"4,750.94"
11748,swastika etching discovered on a school window.,vandalism,nazi,in school,not specified,not specified,CA,Los Angeles,los angeles,6037,4/1/2019,Los Angeles County CA,"9,818,605",34.196397999999995,-118.26186200000001,"4,057.88",693.058,"4,750.94"
11744,swastika vandalism discovered at a school.,vandalism,nazi,in school,not specified,not specified,CA,Los Angeles,marina del ray,6037,4/1/2019,Los Angeles County CA,"9,818,605",34.196397999999995,-118.26186200000001,"4,057.88",693.058,"4,750.94"
11745,swastika vandalism discovered at a school.,vandalism,nazi,in school,not specified,not specified,CA,Los Angeles,north hollywood,6037,4/1/2019,Los Angeles County CA,"9,818,605",34.196397999999995,-118.26186200000001,"4,057.88",693.058,"4,750.94"
9689,a classmate of a jewish student at a middle school drew a swastika on the jewish student's class work.,vandalism,nazi,in school,student,student,CA,Los Angeles,woodland hills,6037,4/1/2019,Los Angeles County CA,"9,818,605",34.196397999999995,-118.26186200000001,"4,057.88",693.058,"4,750.94"
9691,student gestured the nazi salute in front of other students that included at least one jewish student.,performance,nazi,not specified,student,student,CA,Orange,garden grove,6059,4/1/2019,Orange County CA,"3,010,232",33.675686999999996,-117.777207,790.568,157.498,948.066
10196,a swastika was burned into the asphalt at a playground near ellis elementary school.,vandalism,nazi,outside school,not specified,not specified,CO,Denver,denver,8031,4/1/2019,Denver County CO,"600,158",39.761849,-104.880625,153,1.631,154.631
11732,"jewish student victim of ongoing anti-semitic harassment by peers who tell her she should die in a gas chamber, draw swastikas on their hands and show her, yell ""hitler"" in her face, and do the sieg heil in the hallways.",harassment,nazi,in school,student,student,CT,Hartford,southington,9003,4/1/2019,Hartford County CT,"894,014",41.806053000000006,-72.732916,735.097,15.527,750.624
9698,middle school student was the target of anti-semitic slurs and songs.,harassment,general antisemitism,not specified,not specified,student,FL,Orange,winter park,12095,4/1/2019,Orange County FL,"1,145,956",28.514435,-81.323295,903.429,99.831,"1,003.26"
9700,"a jewish student at a middle school found a note in their locker that read, ""kill yourself, you kike.""",harassment,general antisemitism,in school,not specified,student,GA,Cobb,marietta,13067,4/1/2019,Cobb County GA,"688,078",33.93994,-84.574166,339.549,4.969,344.518
9699,"a jewish student at a middle was harassed by another student who said ""death to all the jews"" and mocked the jewish student.",harassment,general antisemitism,not specified,student,student,GA,Gwinnett,gwinnett county,13135,4/1/2019,Gwinnett County GA,"805,321",33.959101000000004,-84.022938,430.383,6.392,436.775
9702,middle school student targeted a jewish classmate with anti-semitic jokes and rhetoric.,harassment,general antisemitism,not specified,student,student,IL,Lake,hawthorn woods,17097,4/1/2019,Lake County IL,"703,462",42.326444,-87.43611800000001,443.67,924.809,"1,368.48"
9707,"a student at an elementary school repeatedly did the sieg heil and stated ""for the fuehrer.""",performance,nazi,not specified,student,student,LA,Orleans Parish,new orleans,22071,4/1/2019,Orleans County LA,"343,829",30.068635999999998,-89.93900699999999,169.423,180.789,350.212
10197,swastika vandalism discovered in a bathroom at a middle school.,vandalism,nazi,in school,not specified,not specified,MA,Norfolk,westwood,25021,4/1/2019,Norfolk County MA,"670,850",42.169703000000005,-71.179875,396.105,48.241,444.346
10199,swastika graffiti discovered in a bathroom at hellgate high school.,vandalism,nazi,in school,not specified,not specified,MT,Missoula,missoula,30063,4/1/2019,Missoula County MT,"109,299",47.027263,-113.89268100000001,"2,593.42",24.896,"2,618.32"
11715,an elementary school teacher discovered that two swastikas had been scratched into school music stands.,vandalism,nazi,in school,not specified,not specified,NJ,Bergen,ridgefield park,34003,4/1/2019,Bergen County NJ,"905,116",40.95909,-74.074522,233.009,13.662,246.671
11724,"""hitler = good"" was found carved into a classroom desk.",vandalism,nazi,in school,not specified,not specified,NJ,Bergen,tenafly,34003,4/1/2019,Bergen County NJ,"905,116",40.95909,-74.074522,233.009,13.662,246.671
11726,swastika vandalism discovered on a desk in a classroom.,vandalism,nazi,in school,not specified,not specified,NJ,Burlington,westampton,34005,4/1/2019,Burlington County NJ,"448,734",39.875786,-74.66300600000001,798.576,21.262,819.838
11743,swastika vandalism discovered on a desk at a school.,vandalism,nazi,in school,not specified,not specified,NJ,Burlington,westampton,34005,4/1/2019,Burlington County NJ,"448,734",39.875786,-74.66300600000001,798.576,21.262,819.838
11741,a student discovered a swastika had been drawn on their desk.,vandalism,nazi,in school,not specified,not specified,NJ,Essex,livingston,34013,4/1/2019,Essex County NJ,"783,969",40.787217,-74.24613599999999,126.212,3.419,129.631
9712,a middle school student made racist and anti-semitic remarks at school including denying that the holocaust happened.,harassment,"general antisemitism, oppression connection, holocaust denial",in school,student,not specified,NJ,Middlesex,highland park,34023,4/1/2019,Middlesex County NJ,"809,858",40.439593,-74.407585,308.914,13.913,322.827
11722,swastika vandalism discovered inside a classroom.,vandalism,nazi,in school,not specified,not specified,NJ,Morris,jefferson,34027,4/1/2019,Morris County NJ,"492,276",40.858581,-74.547427,460.177,21.448,481.625
10203,a jewish student at lakeland regional high school discovered a drawing of a star of david with a swastika in the middle of it was drawn onto her desk in study hall.,vandalism,"general antisemitism, nazi",in school,not specified,student,NJ,Passaic,wanaque,34031,4/1/2019,Passaic County NJ,"501,226",41.033763,-74.300308,184.593,12.512,197.105
10206,swastika vandalism discovered in a bathroom at lawton c. johnson summit middle school.,vandalism,nazi,in school,not specified,not specified,NJ,Union,summit,34039,4/1/2019,Union County NJ,"536,499",40.659871,-74.308696,102.855,2.546,105.401
9714,a swastika found on text book at a high school.,vandalism,nazi,in school,not specified,not specified,NJ,Union,summit,34039,4/1/2019,Union County NJ,"536,499",40.659871,-74.308696,102.855,2.546,105.401
10211,swastika vandalism discovered in a middle school.,vandalism,nazi,in school,not specified,not specified,NY,Ulster,new paltz,36111,4/1/2019,Ulster County NY,"182,493",41.947232,-74.265447,"1,124.24",36.525,"1,160.76"
11723,swastika vandalism discovered on school property.,vandalism,nazi,outside school,not specified,not specified,NY,Westchester,new rochelle,36119,4/1/2019,Westchester County NY,"949,113",41.152770000000004,-73.745912,430.497,69.498,499.995
10238,mckinley elementary school was vandalized with graffiti that included a swastika.,vandalism,nazi,in school,not specified,not specified,OK,Cleveland,norman,40027,4/1/2019,Cleveland County OK,"255,755",35.203117,-97.32833199999999,538.766,19.32,558.086
9730,"at school, a boy drew a swastika a jewish peer's calculator, called her ""jew girl"" and said ""you don't deserve birthday shekels.""","vandalism, harassment","general antisemitism, nazi, money",in school,student,student,PA,Montgomery,erdenheim,42091,4/1/2019,Montgomery County PA,"799,874",40.209998999999996,-75.370201,483.04,4.155,487.195
9732,"jewish student was harassed by classmates for being jewish, was told to ""go burn in a crematorium.""",harassment,"general antisemitism, nazi",not specified,student,student,SC,Greenville,greenville,45045,4/1/2019,Greenville County SC,"451,225",34.892645,-82.372077,785.12,9.746,794.866
10560,a jewish student at a middle school was physically assaulted by a classmate who also taunted him with anti-semitic harassment that included swastika drawings.,harassment,"general antisemitism, nazi",in school,student,student,TX,Harris,houston,48201,4/1/2019,Harris County TX,"4,092,459",29.857273,-95.39303699999999,"1,703.48",74.005,"1,777.48"
10247,"anti-semitic, racist, and homophobic graffiti was discovered at annandale high school.",vandalism,"general antisemitism, oppression connection",in school,not specified,not specified,VA,Fairfax,annandale,51059,4/1/2019,Fairfax County VA,"1,081,726",38.833743,-77.276117,390.969,15.277,406.246
9740,"jewish middle school student harassed by another student who told the jewish student that ""you should go die in a gas chamber,"" ""heil hitler,"" and ""bring back hitler so he can kill all the jews.""",harassment,nazi,not specified,student,student,WI,Waukesha,waukesha,55133,4/1/2019,Waukesha County WI,"389,891",43.019308,-88.30670699999999,549.574,31.022,580.596
11797,"a swastika and the message, ""kill the jews,"" was written on a school sign.",vandalism,nazi,outside school,not specified,not specified,CA,Los Angeles,los angeles,6037,5/1/2019,Los Angeles County CA,"9,818,605",34.196397999999995,-118.26186200000001,"4,057.88",693.058,"4,750.94"
11796,swastika etchings discovered on a school door.,vandalism,nazi,in school,not specified,not specified,CA,Los Angeles,los angeles,6037,5/1/2019,Los Angeles County CA,"9,818,605",34.196397999999995,-118.26186200000001,"4,057.88",693.058,"4,750.94"
9752,jewish high school student was harassed with anti-semitic epithets by classmate.,harassment,general antisemitism,not specified,student,student,CA,Orange,laguna beach,6059,5/1/2019,Orange County CA,"3,010,232",33.675686999999996,-117.777207,790.568,157.498,948.066
9745,"a student at a middle school edited a class project with the message ""hitler did nothing wrong.""",harassment,nazi,in school,student,not specified,CA,Orange,yorba linda,6059,5/1/2019,Orange County CA,"3,010,232",33.675686999999996,-117.777207,790.568,157.498,948.066
9747,"middle school students yelling ""heil hitler"" and making nazi salute to, or in sight of, jewish students.","harassment, performance",nazi,not specified,student,student,CA,Sacramento,sacramento,6067,5/1/2019,Sacramento County CA,"1,418,788",38.450010999999996,-121.340441,964.644,29.374,994.018
10561,jewish middle school student was physically assaulted by another student who also used anti-semitic language to threaten the student.,harassment,general antisemitism,not specified,student,student,CA,San Diego,san marcos,6073,5/1/2019,San Diego County CA,"3,095,313",33.023604,-116.776117,"4,206.63",319.055,"4,525.69"
10252,the athletic field at a middle school was vandalized with swastika graffiti.,vandalism,nazi,outside school,not specified,not specified,CA,San Luis Obispo,los osos,6079,5/1/2019,San Luis Obispo County CA,"269,637",35.385227,-120.44753999999999,"3,298.57",316.98,"3,615.55"
10259,swastika vandalism discovered at a school.,vandalism,nazi,outside school,not specified,not specified,CO,Denver,denver,8031,5/1/2019,Denver County CO,"600,158",39.761849,-104.880625,153,1.631,154.631
9764,"students at a school circulated a petition to classmates via whatsapp to ""burn all jews.""",harassment,nazi,social media,student,not specified,FL,Broward,weston,12011,5/1/2019,Broward County FL,"1,748,066",26.19352,-80.476658,"1,209.79",113.077,"1,322.86"
9762,"a jewish student at a high school was targeted twice in one week by a classmate who asked, ""are you jewish? burn you jew, gas em jew.""",harassment,nazi,in school,student,student,FL,Hernando,brooksville,12053,5/1/2019,Hernando County FL,"172,778",28.567911,-82.464835,472.539,116.483,589.022
11783,a student at paul r. smith middle school was arrested after he wrote a bomb threat on a bathroom wall that included images of swastikas.,"bomb threat, vandalism",nazi,in school,student,school,FL,Pasco,holiday,12101,5/1/2019,Pasco County FL,"464,697",28.302024,-82.45570699999999,746.886,121.568,868.454
11774,"a jewish student was stabbed with a pencil three times and called an ""ugly jew"" and ""loser jew,"" the student was also told ""wish you were dead, jew"" by another student at school.","harassment, harassment",general antisemitism,in school,student,student,KY,Bullitt,mount washington,21029,5/1/2019,Bullitt County KY,"74,319",37.969572,-85.703036,297.024,3.241,300.265
9775,"a middle school student was given a note with swastika drawings by a student who also did the nazi salute and said ""heil hitler.""","harassment, performance",nazi,not specified,student,student,MA,Bristol,easton,25005,5/1/2019,Bristol County MA,"548,285",41.748576,-71.087062,553.096,138.13,691.226
10267,swastika vandalism discovered in a bathroom at a high school.,vandalism,nazi,in school,not specified,not specified,MA,Bristol,easton,25005,5/1/2019,Bristol County MA,"548,285",41.748576,-71.087062,553.096,138.13,691.226
9779,a student at newburyport high school made the nazi salute while standing near two jewish students. the same student also altered the school's song to praise hitler.,"harassment, performance",nazi,in school,student,student,MA,Essex,newburyport,25009,5/1/2019,Essex County MA,"743,159",42.642711,-70.865107,492.563,335.911,828.474
10268,"a swastika and a ""vague, threatening message"" was discovered inside a bathroom at keefe technical high school.",vandalism,nazi,in school,not specified,not specified,MA,Middlesex,framingham,25017,5/1/2019,Middlesex County MA,"1,503,085",42.479477,-71.396507,817.817,29.243,847.06
10276,a bathroom at a middle school was vandalized with graffiti that included two swastika drawings.,vandalism,nazi,in school,not specified,not specified,MA,Middlesex,melrose,25017,5/1/2019,Middlesex County MA,"1,503,085",42.479477,-71.396507,817.817,29.243,847.06
10275,"a desk was at a middle school was vandalized with a swastika and the message ""i will kill you.""",vandalism,nazi,in school,not specified,not specified,MA,Middlesex,newton,25017,5/1/2019,Middlesex County MA,"1,503,085",42.479477,-71.396507,817.817,29.243,847.06
10273,swastika vandalism discovered in a bathroom at a middle school.,vandalism,nazi,in school,not specified,not specified,MA,Middlesex,watertown,25017,5/1/2019,Middlesex County MA,"1,503,085",42.479477,-71.396507,817.817,29.243,847.06
10272,a desk in a classroom at a middle school was vandalized with a drawing of a swastika.,vandalism,nazi,in school,not specified,not specified,MA,Middlesex,weston,25017,5/1/2019,Middlesex County MA,"1,503,085",42.479477,-71.396507,817.817,29.243,847.06
9774,the jewish student union sign at a high school was defaced with a swastika.,vandalism,nazi,in school,not specified,not specified,MA,Norfolk,brookline,25021,5/1/2019,Norfolk County MA,"670,850",42.169703000000005,-71.179875,396.105,48.241,444.346
