adl_id,Description,Type,Nature,Location,Perpetrator,Target,State,County,City,Fips_County,Date,CountyState,population_2010,latitude,longitude,Land_Area,Water_Area,Total_Area
3297,a student threw money at another student and made anti-semitic comments towards her.,harassment,money,not specified,student,student,GA,Cobb,marietta,13067,4/1/2017,Cobb County GA,"688,078",33.93994,-84.574166,339.549,4.969,344.518
3294,students directed the heil hitler salute to a jewish student during class.,performance,nazi,in school,student,student,GA,Fulton,johns creek,13121,4/1/2017,Fulton County GA,"920,581",33.790034000000006,-84.468182,526.635,7.69,534.325
3295,swastika found by a jewish student in the boy's bathroom of a middle school.,vandalism,nazi,in school,not specified,not specified,GA,Fulton,johns creek,13121,4/1/2017,Fulton County GA,"920,581",33.790034000000006,-84.468182,526.635,7.69,534.325
3835,anti-semitic messages written on school playground.,vandalism,general antisemitism,outside school,not specified,not specified,NJ,Monmouth,loch arbour village,34025,4/1/2017,Monmouth County NJ,"630,380",40.287056,-74.152446,468.793,196.527,665.32
3834,anti-semitic graffiti found scrawled at school playground.,vandalism,general antisemitism,outside school,not specified,not specified,NJ,Monmouth,manalapan,34025,4/1/2017,Monmouth County NJ,"630,380",40.287056,-74.152446,468.793,196.527,665.32
4182,two school buses with hebrew writing on them were vandalized.,vandalism,general antisemitism,outside school,not specified,not specified,NY,Kings,brooklyn,36047,4/1/2017,Kings County NY,"2,504,700",40.635133,-73.950777,70.816,26.102,96.918
4161,swastika graffiti at high school.,vandalism,nazi,in school,not specified,not specified,NY,Queens,long island city,36081,4/1/2017,Queens County NY,"2,230,722",40.658557,-73.837929,108.532,69.675,178.207
4619,"a high school history teacher told students during a lesson on world war ii, that jews killed jesus which is why hitler wanted to annihilate the jews.",harassment,"general antisemitism, nazi",in school,teacher,not specified,TX,Harris,katy,48201,4/1/2017,Harris County TX,"4,092,459",29.857273,-95.39303699999999,"1,703.48",74.005,"1,777.48"
2739,ongoing anti-semitic anti-semitic incident: harassment and bullying at a school.,harassment,general antisemitism,in school,student,student,AZ,Pima,vail,4019,5/1/2017,Pima County AZ,"980,263",32.128237,-111.783018,"9,187.04",2.061,"9,189.10"
2893,"graffiti including two swastikas, the nazi flag, and image of a bag of money with a star of david next to it, and the words ""jews are evil"" were found etched into a desk at a high school.",vandalism,"general antisemitism, nazi, money",in school,not specified,not specified,CA,Alameda,alameda,6001,5/1/2017,Alameda County CA,"1,510,271",37.648081,-121.91330400000001,739.017,82.311,821.328
2884,swastika drawn in feces discover in a boy's bathroom at a high school.,vandalism,nazi,in school,not specified,not specified,CA,Los Angeles,calabasas,6037,5/1/2017,Los Angeles County CA,"9,818,605",34.196397999999995,-118.26186200000001,"4,057.88",693.058,"4,750.94"
2891,a jewish student harassed with holocaust-related verbiage.,harassment,nazi,not specified,not specified,student,CA,Marin,larkspur,6041,5/1/2017,Marin County CA,"252,409",38.051817,-122.745974,520.306,307.886,828.192
2900,"a public school teacher has been repeatedly harassed by students yelling ""death to jews"" and ""heil hitler"" outside their classroom, and a swastika was drawn on the whiteboard.","vandalism, harassment",nazi,in school,student,teacher,CA,Monterey,monterey,6053,5/1/2017,Monterey County CA,"415,057",36.240107,-121.315573,"3,280.60",490.626,"3,771.22"
2897,"three fourth grade students sang to a fellow student a song with the words, ""we?re nazi?s and we hate the jews. we?re nazi?s and we are creeping you. we?re nazi?s and we?re killing you. we?e nazi?s and we go (sound of a machine gun.)""",harassment,nazi,in school,student,student,CA,Orange,laguna beach,6059,5/1/2017,Orange County CA,"3,010,232",33.675686999999996,-117.777207,790.568,157.498,948.066
2898,"a sixth-grade jewish boy was the victim of anti-semitic bullying as students taunted him with swastikas in class, and brought cigarette lighters to school telling the victim they will burn him ""like they did in the holocaust.""",harassment,nazi,in school,student,student,CA,Sonoma,healdsburg,6097,5/1/2017,Sonoma County CA,"483,878",38.532574,-122.945194,"1,575.85",192.098,"1,767.95"
3042,"a jewish elementary school boy was told by a fellow student ""all jews lie,"" and experienced continued bullying from the same child.",harassment,general antisemitism,not specified,student,student,CO,Denver,denver,8031,5/1/2017,Denver County CO,"600,158",39.761849,-104.880625,153,1.631,154.631
3092,two students were victims of anti-semitic bullying.,harassment,general antisemitism,not specified,student,student,CT,Hartford,newington,9003,5/1/2017,Hartford County CT,"894,014",41.806053000000006,-72.732916,735.097,15.527,750.624
3222,a middle school student faced continued anti-semitic anti-semitic incident: harassment from fellow students.,harassment,general antisemitism,not specified,student,student,FL,Hernando,spring hill,12053,5/1/2017,Hernando County FL,"172,778",28.567911,-82.464835,472.539,116.483,589.022
3225,swastikas and racial slurs found on walls at a high school.,vandalism,"nazi, oppression connection",in school,not specified,not specified,FL,Palm Beach,lantana,12099,5/1/2017,Palm Beach County FL,"1,320,134",26.645763,-80.448673,"1,969.76",413.246,"2,383.01"
3299,"swastika with the letters spelling out ""nazi,"" discovered by an eighth-grade jewish boy in a school bathroom.",vandalism,nazi,in school,not specified,not specified,GA,Fulton,johns creek,13121,5/1/2017,Fulton County GA,"920,581",33.790034000000006,-84.468182,526.635,7.69,534.325
3494,a middle school student and a high school student defaced school property with a swastika.,vandalism,nazi,in school,student,not specified,MA,Plymouth,duxbury,25023,5/1/2017,Plymouth County MA,"494,919",41.987196000000004,-70.74194200000001,659.075,434.177,"1,093.25"
3652,"swastikas, a racial slur, and a homophobic message spray painted outside forest hills central high school.",vandalism,"nazi, oppression connection",outside school,not specified,not specified,MI,Kent,grand rapids,26081,5/1/2017,Kent County MI,"602,622",43.032497,-85.547446,846.948,24.996,871.944
3709,"anti-semitic, pro-nazi, and racist graffiti found at a public school.",vandalism,"general antisemitism, nazi, oppression connection",in school,not specified,not specified,MS,Lauderdale,meridian,28075,5/1/2017,Lauderdale County MS,"80,261",32.403998,-88.660449,703.634,11.52,715.154
3858,"a swastika was drawn on the wall of a boys' bathroom stall, and a hateful message against jews in a girls' bathroom stall at a high school.",vandalism,"general antisemitism, nazi",in school,not specified,not specified,NJ,Bergen,oradell,34003,5/1/2017,Bergen County NJ,"905,116",40.95909,-74.074522,233.009,13.662,246.671
3856,swastika and other obscenities were painted on the property of an elementary school.,vandalism,nazi,outside school,not specified,not specified,NJ,Essex,caldwell,34013,5/1/2017,Essex County NJ,"783,969",40.787217,-74.24613599999999,126.212,3.419,129.631
3852,anti-semitic graffiti on school desk.,vandalism,general antisemitism,in school,not specified,not specified,NJ,Middlesex,east brunswick,34023,5/1/2017,Middlesex County NJ,"809,858",40.439593,-74.407585,308.914,13.913,322.827
3841,"note left on jewish student's desk with a swastika and the acronym ""kys,"" which means ""kill yourself.""",harassment,"general antisemitism, nazi",in school,not specified,student,NJ,Middlesex,east brunswick,34023,5/1/2017,Middlesex County NJ,"809,858",40.439593,-74.407585,308.914,13.913,322.827
3851,"a note was found at a school that contained an image of a swastika and the words ""white is supreme.""",harassment,"nazi, oppression connection",in school,not specified,not specified,NJ,Middlesex,east brunswick,34023,5/1/2017,Middlesex County NJ,"809,858",40.439593,-74.407585,308.914,13.913,322.827
3847,one student drew a swastika on another student's paper.,vandalism,nazi,in school,student,student,NJ,Middlesex,east brunswick,34023,5/1/2017,Middlesex County NJ,"809,858",40.439593,-74.407585,308.914,13.913,322.827
4196,anti-semitic graffiti found in male locker room at a school.,vandalism,general antisemitism,in school,not specified,not specified,NY,Bronx,bronx,36005,5/1/2017,Bronx County NY,"1,385,108",40.848711,-73.852939,42.096,15.382,57.478
4211,a swastika was carved into the sidewalk near a jewish school in brooklyn's gravesend neighborhood.,vandalism,nazi,outside school,not specified,not specified,NY,Kings,brooklyn,36047,5/1/2017,Kings County NY,"2,504,700",40.635133,-73.950777,70.816,26.102,96.918
4195,"graffiti reading ""nazi skin head,"" a swastika, and a threatening message discovered in a high school bathroom.",vandalism,nazi,in school,not specified,not specified,NY,New York,new york,36061,5/1/2017,New York County NY,"1,585,873",40.776557000000004,-73.970174,22.829,10.762,33.591
4187,"a swastika and the phrase, ""no jews,"" discovered in a boy's bathroom at an elementary school.",vandalism,"general antisemitism, nazi",in school,not specified,not specified,NY,Queens,belle harbor,36081,5/1/2017,Queens County NY,"2,230,722",40.658557,-73.837929,108.532,69.675,178.207
2914,anti-semitic graffiti found at elementary school.,vandalism,general antisemitism,in school,not specified,not specified,CA,Alameda,alameda,6001,6/1/2017,Alameda County CA,"1,510,271",37.648081,-121.91330400000001,739.017,82.311,821.328
2904,students vandalized school with graffiti that included a swastika.,vandalism,"general antisemitism, nazi",in school,student,not specified,CA,Alameda,fremont,6001,6/1/2017,Alameda County CA,"1,510,271",37.648081,-121.91330400000001,739.017,82.311,821.328
2910,holocaust denial posters found posted a strip mall and near a jewish day school.,literature dump,holocaust denial,off-campus,not specified,not specified,CA,Santa Clara,sunnyvale,6085,6/1/2017,Santa Clara County CA,"1,781,642",37.220777000000005,-121.69062199999999,"1,290.10",13.967,"1,304.07"
3871,anti-semitic and racist graffiti and swastikas were spray-painted on sign at elementary school playground.,vandalism,"general antisemitism, nazi, oppression connection",outside school,not specified,not specified,NJ,Essex,caldwell,34013,6/1/2017,Essex County NJ,"783,969",40.787217,-74.24613599999999,126.212,3.419,129.631
3867,an anti-semitic message was scrawled on playground equipment at an elementary school.,vandalism,general antisemitism,outside school,not specified,not specified,NJ,Middlesex,east brunswick,34023,6/1/2017,Middlesex County NJ,"809,858",40.439593,-74.407585,308.914,13.913,322.827
3865,students used anti-semitic screen names for a class assignment.,cyberbullying,general antisemitism,in school,student,not specified,NJ,Morris,east hanover,34027,6/1/2017,Morris County NJ,"492,276",40.858581,-74.547427,460.177,21.448,481.625
4015,"students overheard telling holocaust ""jokes"" in school.",harassment,nazi,in school,student,not specified,NM,Bernalillo,albuquerque,35001,6/1/2017,Bernalillo County NM,"662,564",35.054002000000004,-106.66906499999999,"1,160.83",6.36,"1,167.19"
4233,known local school bus with jewish iconography set ablaze in arson attack.,vandalism,general antisemitism,outside school,not specified,not specified,NY,Kings,brooklyn,36047,6/1/2017,Kings County NY,"2,504,700",40.635133,-73.950777,70.816,26.102,96.918
2940,"anti-semitic incident: vandalism including a swastika and the words ""white power"" written at a middle school.",vandalism,"nazi, oppression connection",in school,not specified,not specified,CA,Placer,roseville,6061,8/1/2017,Placer County CA,"348,432",39.062032,-120.722718,"1,407.01",95.447,"1,502.46"
2934,a jewish high school student experienced repeated anti-semitic anti-semitic incident: harassment and bullying by his peers.,harassment,general antisemitism,not specified,student,student,CA,Riverside,riverside,6065,8/1/2017,Riverside County CA,"2,189,641",33.729828000000005,-116.00223899999999,"7,206.48",96.94,"7,303.42"
2928,swastika were found spay-painted at a high school before fall semester began.,vandalism,nazi,in school,not specified,not specified,CA,Sonoma,santa rosa,6097,8/1/2017,Sonoma County CA,"483,878",38.532574,-122.945194,"1,575.85",192.098,"1,767.95"
3055,"a group of middle school girls were talking when a male student ran up, shouted ""heil hitler!"" and performed the nazi salute.",performance,nazi,in school,student,student,CO,Adams,brighton,8001,8/1/2017,Adams County CO,"441,603",39.874325,-104.331872,"1,167.65",16.243,"1,183.90"
3137,"the word ""kike"" was written on a high school building.",vandalism,general antisemitism,outside school,not specified,not specified,DC,District of Columbia,washington,11001,8/1/2017,District of Columbia County DC,"601,723",38.904149,-77.017094,61.048,7.292,68.34
3305,"a social media image of a group of high school students played a variation of beer pong, which they called ""nazis vs. jews"" went around the internet and community.","performance, cyberbullying",nazi,social media,student,not specified,GA,Fulton,atlanta,13121,8/1/2017,Fulton County GA,"920,581",33.790034000000006,-84.468182,526.635,7.69,534.325
3308,"elementary school teacher, who is jewish, discovered a swastika drawn on one of her planters.",vandalism,nazi,in school,not specified,teacher,GA,Fulton,atlanta,13121,8/1/2017,Fulton County GA,"920,581",33.790034000000006,-84.468182,526.635,7.69,534.325
3407,swastika graffiti was discovered on a student's car at a high school.,vandalism,nazi,outside school,not specified,student,KY,Oldham,goshen,21185,8/1/2017,Oldham County KY,"60,316",38.400046,-85.456059,187.218,9.216,196.434
3521,swastika drawn in the dirt at marblehead high school's softball field.,vandalism,nazi,outside school,not specified,not specified,MA,Essex,marblehead,25009,8/1/2017,Essex County MA,"743,159",42.642711,-70.865107,492.563,335.911,828.474
4273,a jewish star and a swastika were spray-painted on a slide at windermere boulevard elementary school.,vandalism,"general antisemitism, nazi",outside school,not specified,not specified,NY,Erie,amherst,36029,8/1/2017,Erie County NY,"919,040",42.752759000000005,-78.778192,"1,042.69",184.161,"1,226.85"
4287,"graffiti including swastikas, anti-semitic messages, and gang graffiti were found at syosset high school.",vandalism,"general antisemitism, nazi",in school,not specified,not specified,NY,Nassau,syosset,36059,8/1/2017,Nassau County NY,"1,339,532",40.729687,-73.589384,284.716,168.518,453.234
4669,a swastika was discovered in a bathroom stall at briar woods high school.,vandalism,nazi,in school,not specified,not specified,VA,Loudoun,ashburn,51107,8/1/2017,Loudoun County VA,"312,311",39.08113,-77.638857,515.561,5.577,521.138
2962,"anti-semitic and racist instagram account ""i hate jews"" created by berkeley high school students.",cyberbullying,"general antisemitism, oppression connection",social media,student,not specified,CA,Alameda,berkeley,6001,9/1/2017,Alameda County CA,"1,510,271",37.648081,-121.91330400000001,739.017,82.311,821.328
2958,a middle school student drew a swastika on the pavement at school.,vandalism,nazi,outside school,student,not specified,CA,Contra Costa,moraga,6013,9/1/2017,Contra Costa County CA,"1,049,025",37.919478999999995,-121.95154299999999,715.937,87.833,803.77
2964,jewish middle school student bullied with anti-semitic jokes and comments.,harassment,general antisemitism,not specified,student,student,CA,Los Angeles,long beach,6037,9/1/2017,Los Angeles County CA,"9,818,605",34.196397999999995,-118.26186200000001,"4,057.88",693.058,"4,750.94"
2965,elementary school student victim of anti-semitic bullying by a classmate.,harassment,general antisemitism,not specified,student,student,CA,Orange,laguna beach,6059,9/1/2017,Orange County CA,"3,010,232",33.675686999999996,-117.777207,790.568,157.498,948.066
2953,anti-semitic incident: vandalism that included a swastika were spray-painted on the campus of a high school.,vandalism,nazi,outside school,not specified,not specified,CA,San Diego,san diego,6073,9/1/2017,San Diego County CA,"3,095,313",33.023604,-116.776117,"4,206.63",319.055,"4,525.69"
3058,student at elementary school victim of anti-semitic bullying and anti-semitic incident: harassment by classmate.,harassment,general antisemitism,not specified,student,student,CO,Boulder,boulder,8013,9/1/2017,Boulder County CO,"294,567",40.094826,-105.39838200000001,726.289,14.081,740.37
3107,a swastika was found etched into a classroom table.,vandalism,nazi,in school,not specified,not specified,CT,Fairfield,ridgefield,9001,9/1/2017,Fairfield County CT,"916,829",41.228103000000004,-73.36675699999999,624.89,212.033,836.923
3683,"a swastika and the word ""soon"" were discovered at a high school on the eve of yom kippur.",vandalism,nazi,in school,not specified,not specified,MN,Stearns,st. cloud,27145,9/1/2017,Stearns County MN,"150,642",45.555234999999996,-94.61048199999999,"1,343.13",46.819,"1,389.95"
3908,"""hate kikes"" was written on a bathroom wall at a high school.",vandalism,general antisemitism,in school,not specified,not specified,NJ,Bergen,franklin lakes,34003,9/1/2017,Bergen County NJ,"905,116",40.95909,-74.074522,233.009,13.662,246.671
3910,swastika carved into the bulletin board in classroom at a high school.,vandalism,nazi,in school,not specified,not specified,NJ,Bergen,hackensack,34003,9/1/2017,Bergen County NJ,"905,116",40.95909,-74.074522,233.009,13.662,246.671
4307,two swastikas drawn on the sidewalk outside a jewish school.,vandalism,nazi,outside school,not specified,not specified,NY,Kings,brooklyn,36047,9/1/2017,Kings County NY,"2,504,700",40.635133,-73.950777,70.816,26.102,96.918
4300,"anti-semitic, racist, and homophobic graffiti discovered on desk at a high school.",vandalism,"general antisemitism, oppression connection",in school,not specified,not specified,NY,Nassau,old westbury,36059,9/1/2017,Nassau County NY,"1,339,532",40.729687,-73.589384,284.716,168.518,453.234
4459,anti-semitic slurs and white supremacist language were graffitied on the exterior of a high school.,vandalism,"general antisemitism, oppression connection",outside school,not specified,not specified,OR,Lane,eugene,41039,9/1/2017,Lane County OR,"351,715",43.928276000000004,-122.897678,"4,553.12",168.746,"4,721.87"
2745,jewish high school student victim of anti-semitic bullying at school.,harassment,general antisemitism,in school,student,student,AZ,Pima,tucson,4019,10/1/2017,Pima County AZ,"980,263",32.128237,-111.783018,"9,187.04",2.061,"9,189.10"
2974,"jewish student called a a ""yiddish piece of shit"" by a classmate.",harassment,general antisemitism,not specified,student,student,CA,Contra Costa,walnut creek,6013,10/1/2017,Contra Costa County CA,"1,049,025",37.919478999999995,-121.95154299999999,715.937,87.833,803.77
2979,"man drove by jewish high school yelling ""white power"" and made obscene gestures.",harassment,"general antisemitism, oppression connection",outside school,outsider,school,CA,Los Angeles,los angeles,6037,10/1/2017,Los Angeles County CA,"9,818,605",34.196397999999995,-118.26186200000001,"4,057.88",693.058,"4,750.94"
2987,swastika painted in red on the asphalt at a high school.,vandalism,nazi,outside school,not specified,not specified,CA,Marin,san anselmo,6041,10/1/2017,Marin County CA,"252,409",38.051817,-122.745974,520.306,307.886,828.192
2970,jewish middle school-aged student victim of ongoing anti-semitic anti-semitic incident: harassment and bullying at school.,harassment,general antisemitism,in school,student,student,CA,San Diego,bonita,6073,10/1/2017,San Diego County CA,"3,095,313",33.023604,-116.776117,"4,206.63",319.055,"4,525.69"
2978,"a swastika and the words ""sig hil"" (sic) were found drawn on the wall of a boys restroom at a high school.",vandalism,nazi,in school,not specified,not specified,CA,Yolo,davis,6113,10/1/2017,Yolo County CA,"200,849",38.679268,-121.903178,"1,014.69",8.868,"1,023.56"
2977,middle school received a number of emails through their anonymous reporting application containing images of swastikas.,cyberbullying,nazi,social media,not specified,student,CA,Yolo,davis,6113,10/1/2017,Yolo County CA,"200,849",38.679268,-121.903178,"1,014.69",8.868,"1,023.56"
3065,anti-semitic anti-semitic incident: harassment and bullying at elementary school.,harassment,general antisemitism,in school,student,student,CO,Denver,denver,8031,10/1/2017,Denver County CO,"600,158",39.761849,-104.880625,153,1.631,154.631
3115,swastika drawn on jewish student's locker.,vandalism,nazi,in school,not specified,student,CT,Fairfield,stamford,9001,10/1/2017,Fairfield County CT,"916,829",41.228103000000004,-73.36675699999999,624.89,212.033,836.923
3117,"a note that read: ""jews will burn"" was left on a middle school student's locker.",harassment,nazi,in school,not specified,student,CT,Fairfield,wilton,9001,10/1/2017,Fairfield County CT,"916,829",41.228103000000004,-73.36675699999999,624.89,212.033,836.923
3110,student at a middle school drew a swastika in the boys' bathroom.,vandalism,nazi,in school,student,not specified,CT,Fairfield,wilton,9001,10/1/2017,Fairfield County CT,"916,829",41.228103000000004,-73.36675699999999,624.89,212.033,836.923
3242,jewish student victim of anti-semitic bullying and anti-semitic incident: harassment at school.,harassment,general antisemitism,in school,student,student,FL,Duval,jacksonville beach,12031,10/1/2017,Duval County FL,"864,263",30.335245,-81.648113,762.192,156.26,918.452
3246,jewish elementary school student victim of anti-semitic anti-semitic incident: harassment and threat by classmate.,harassment,general antisemitism,not specified,student,student,FL,Orange,orlando,12095,10/1/2017,Orange County FL,"1,145,956",28.514435,-81.323295,903.429,99.831,"1,003.26"
3243,jewish teacher victim of ongoing anti-semitic anti-semitic incident: harassment by students.,harassment,general antisemitism,in school,student,teacher,FL,Orange,orlando,12095,10/1/2017,Orange County FL,"1,145,956",28.514435,-81.323295,903.429,99.831,"1,003.26"
3239,jewish students victims of anti-semitic comments at high school.,harassment,general antisemitism,in school,not specified,student,FL,Palm Beach,wellington,12099,10/1/2017,Palm Beach County FL,"1,320,134",26.645763,-80.448673,"1,969.76",413.246,"2,383.01"
3543,a student at stoughton high school drew a swastika during a group project to make up designs for a flag.,vandalism,nazi,in school,student,not specified,MA,Norfolk,stoughton,25021,10/1/2017,Norfolk County MA,"670,850",42.169703000000005,-71.179875,396.105,48.241,444.346
3659,wood chips were used to create a swastika on the playground of an elementary school.,vandalism,nazi,outside school,not specified,not specified,MI,Wayne,plymouth,26163,10/1/2017,Wayne County MI,"1,820,584",42.284664,-83.261953,612.08,60.597,672.677
3955,"""jew"" written on the wall in the boy's bathroom at a high school.",vandalism,general antisemitism,in school,not specified,not specified,NJ,Bergen,franklin lakes,34003,10/1/2017,Bergen County NJ,"905,116",40.95909,-74.074522,233.009,13.662,246.671
3932,"students at a middle school made a group chat called ""kill all jews.""",cyberbullying,general antisemitism,social media,student,not specified,NJ,Essex,north caldwell,34013,10/1/2017,Essex County NJ,"783,969",40.787217,-74.24613599999999,126.212,3.419,129.631
3950,jewish student victim of anti-semitic anti-semitic incident: harassment.,harassment,general antisemitism,not specified,not specified,student,NJ,Morris,mountain lakes,34027,10/1/2017,Morris County NJ,"492,276",40.858581,-74.547427,460.177,21.448,481.625
3936,non-jewish high school students throwing pennies and other objects at observant jews they see.,harassment,money,not specified,student,student,NJ,Ocean,toms river,34029,10/1/2017,Ocean County NJ,"576,567",39.86585,-74.26302700000001,628.781,286.62,915.401
4017,jewish high school student discovered a swastika drawn in the dirt on his car.,vandalism,nazi,outside school,not specified,student,NM,Bernalillo,albuquerque,35001,10/1/2017,Bernalillo County NM,"662,564",35.054002000000004,-106.66906499999999,"1,160.83",6.36,"1,167.19"
4335,students made anti-semitic comments to other students at middle school.,harassment,general antisemitism,in school,student,student,NY,Kings,brooklyn,36047,10/1/2017,Kings County NY,"2,504,700",40.635133,-73.950777,70.816,26.102,96.918
4327,members of the school district made disparaging and anti-semitic comments about the jewish community in their district.,harassment,general antisemitism,not specified,school personnel,outsider,NY,Schenectady,rotterdam,36093,10/1/2017,Schenectady County NY,"154,727",42.817541999999996,-74.043583,204.516,4.87,209.386
4673,swastika graffiti at school.,vandalism,nazi,in school,not specified,not specified,VA,Prince William,woodbridge,51153,10/1/2017,Prince William County VA,"402,002",38.702332,-77.478887,336.402,12.073,348.475
2997,middle school student caught carving a swastika into a desk.,vandalism,nazi,in school,student,not specified,CA,San Francisco,san francisco,6075,11/1/2017,San Francisco County CA,"805,235",37.727239000000004,-123.032229,46.873,185.016,231.889
2996,"student drew a swastika and wrote ""heil hitler"" with a sharpie on a desk in a jewish teacher's classroom.",vandalism,nazi,in school,student,teacher,CA,San Francisco,san francisco,6075,11/1/2017,San Francisco County CA,"805,235",37.727239000000004,-123.032229,46.873,185.016,231.889
2990,opposing soccer team harassed jewish high school players with anti-semitic taunts.,harassment,general antisemitism,school event,student,student,CA,San Francisco,san francisco,6075,11/1/2017,San Francisco County CA,"805,235",37.727239000000004,-123.032229,46.873,185.016,231.889
